id,title,real,num_comments,score,created_utc
9n4hav,Amazon Reportedly Killed an AI Recruitment System Because It Couldn't Stop the Tool from Discriminating Against Women,True,1995,34534,1539212540
74jm6g,Applebee's offering $1 margaritas in October to remind people it's also a 'bar',True,2596,34421,1507243829
73f7rd,Nintendo confirms Mario was originally punching Yoshi in the head,True,1129,34399,1506782002
8dba2x,InfoWars' Alex Jones Says He's Been Defamed by Defamation Suits,True,916,34365,1524104176
6dnub2,"Accused of underpaying women, Google says it's too expensive to get wage data",True,3260,34281,1495893767
9c0kzc,Nestle says slavery reporting requirements could cost customers,True,1826,34215,1535778506
4w54a2,Rio 2016: Officials forced to cut their way into Olympic stadium after losing keys to gate,True,1240,34094,1470325223
6rjyzj,Robert Pattinson refused to perform sex act with dog for new film,True,3377,34043,1501847749
7cfhgg,"Philippines’ Duterte says he stabbed someone to death as a teen, then proposes hosting human rights summit",True,1963,33991,1510494758
8ol7mp,Israel responds with 'Mean Girls' GIF after Iran's Ayatollah Khamenei's nuclear threats,True,1968,33947,1528148414
6lu2m4,Pizza man celebrated as 'hero' after making it through G20 crowds,True,1543,33836,1499438377
7wa1n4,Study finds Americans who join ISIS are disappointed by the experience,True,1702,33756,1518140817
7q11t9,Local teenager robbed at gunpoint by teen he planned to rob,True,859,33700,1515803237
6gg5n0,"After finding his doppelganger, Kansas City man is freed from prison",True,2212,33691,1497112587
8cvrdo,Man declares he is now attracted to men after taking painkillers,True,2246,33678,1523964075
8a6yyy,BP claims an oil spill off Australia's coast would be a 'welcome boost' to local economies,True,1818,33518,1522991925
64xnno,"Prisoners built two PCs from parts, hid them in ceiling, connected to the State's network and did cybershenanigans",True,1938,33503,1491997918
6yny3j,"Dennis Rodman offers to help Trump, US 'straighten things out' with North Korea",True,2179,33408,1504798338
5k7wxw,Christmas service accidentally prints words to Tupac's ‘Hail Mary’ instead of carol,True,736,33395,1482662538
a18nk8,Russian bank: we assigned $12 billion 'loan' to poor African state by mistake,True,1113,33381,1543428246
6xzxzz,World Clown Association Complains The Movie ‘IT’ Is Hurting Real Clowns,True,2685,33367,1504526955
6szijs,"Knife robber tries to rob Glasgow shop but is beaten with mop, tries to rob nearby shop and is beaten with mop again",True,981,33367,1502434997
4r2rmz,Obama dreams of opening a T-shirt shack in Hawaii after he leaves the presidency,True,2329,33290,1467564829
72jb0j,Rapper B.o.B. Has Started a GoFundMe Campaign to Prove That the Earth Is Flat,True,3631,33286,1506419388
5ih9ua,Pilot 'congratulates' passengers for drinking all alcohol on plane,True,1593,33263,1481805324
96rl4b,Florida candidate poses with fake diploma after questions about her credentials,True,1793,33262,1534101920
72o0eg,Mike Pence warns U.S. heading for Canada-style health care if Graham-Cassidy bill fails,True,6394,33165,1506465017
656i49,Congressman tells angry constituents the idea that they pay his salary is ‘bullcrap’,True,2567,33159,1492100483
58tggr,American airline wins right to weigh passengers to prevent crash landings,True,1485,33131,1477148214
7gm4qf,Woman left homeless after thieves steal her house,True,1335,33049,1512046499
6sm0vg,A Saudi singer was jailed after dabbing during a concert,True,1641,33039,1502290813
9l20wy,"Paige Patterson, Who Was Fired For How He Handled Student Rape Allegations, Will Now Teach a Christian Ethics Course",True,1311,32965,1538579471
a1s9ji,Youporn bans Starbucks after Starbucks banned Porn,True,1154,32949,1543583204
70700e,NC mom invents a spray she says will attract any Bigfoot within a mile and a half,True,1840,32932,1505442058
74p90l,"New type of northern lights discovered, named Steve",True,660,32927,1507311797
9bwk3l,"Astronauts find hole in the International Space Station, plug it with thumb",True,1109,32779,1535743204
8park8,US Kindergartens Now Teaching Nursery Rhymes To Prep Kids For School Shooters,True,4197,32729,1528381895
8vasb4,Top ICE Lawyer Sentenced to Four Years in Prison For Stealing Immigrants’ Identities,True,890,32678,1530460249
7lwsw3,"Enraged naked postal worker goes on killing spree, police say",True,2220,32581,1514141892
5hzl1w,"Pipeline spills 176,000 gallons of crude into creek about 150 miles from Dakota Access protest camp",True,3040,32565,1481580100
95b25x,"In Amsterdam, Even The Tourists Say There Are Too Many Tourists",True,2397,32525,1533643754
83c5ms,"The Shape Of Water would have been less popular if she'd fucked a dolphin, reports guy who once fucked a dolphin",True,1068,32344,1520647435
95khyb,Man grieved at wrong grave for 30 years due to misplaced headstone,True,913,32258,1533720281
5szy88,DeVos backlash Sees Parents Threatening to Homeschool Kids,True,6910,32192,1486646635
9r1hbr,Vatican Releases Pokemon GO Clone For Catholics,True,1470,32094,1540400367
7dij0t,2 accidentally shot at church during church shooting discussion,True,3645,31849,1510895220
90fjja,"Child spies used only when very necessary, says Downing Street",True,1160,31740,1532089563
5mr96m,Pet deer named after Bambi character shot dead in front of US family in their driveway,True,3943,31740,1483888439
7l98cd,Amazon removes circumcision training kits from sale,True,1591,31736,1513860324
6idfl0,Phoenix flights cancelled because it's too hot for planes,True,3439,31729,1497958204
8ebcqw,"'Sorry,' says man, 19, who opened fire at Florida high school",True,2674,31625,1524489309
7mgsb9,Russia warns US against 'meddling' in presidential election,True,2014,31592,1514399368
5r9tlg,"Nebraska flag flew upside down at Capitol for 10 days and 'nobody noticed,' says senator who wants design change",True,2101,31519,1485885872
77u3bw,Georgia lawmaker: Can people with HIV be 'legally' quarantined?,True,3827,31412,1508600639
7pg3d4,Charlie Daniels warns Taco Bell: 'The illuminati is not a frivolous subject',True,1431,31241,1515596424
8nslwe,"German zoo's 'escaped' animals didn't actually escape, just hiding",True,865,31055,1527865941
9s94o0,"To fight high drug prices, Utah will pay for public employees to go fill prescriptions in Mexico",True,1653,31031,1540779381
90z33c,Court Recommends Electronic Monitoring For Woman Accused Of Escaping Electronic Monitoring,True,401,30998,1532278152
96xl8e,Slovakian woman arrested for playing opera non-stop for 16 years,True,1594,30913,1534160455
5t9utb,Moscow Says It Has Nothing to Do With Hundreds of Tanks in Eastern Ukraine,True,2540,30766,1486760052
7suft1,Jessica Simpson sued for posting paparazzi photo of herself on Instagram,True,3126,30745,1516864398
6wje1q,"Grizzly bears go vegetarian due to climate change, choosing berries over salmon",True,1130,30687,1503927008
7ajz3p,Denver police have forgotten about people in their custody overnight three times this year,True,1583,30697,1509721692
5sdr6j,"Lady Gaga's super bowl halftime performance was actually a Satanic ritual, say the Alt-Right",True,1049,30650,1486381011
5i3z62,"And You Thought Your Day Was Bad: Suspects Pocket Dial 911, Discuss Plans To Rob Restaurant...Where Police Chief Was Eating",True,1006,30505,1481640870
4y6wc9,"Omaha dad finds pot brownies, eats 4 of them, says mean things to cat",True,1995,30452,1471454699
9rkgki,"Utah lawmaker doesn't recommend 'shooting up marijuana,' but says 'no big deal' after first-use",True,1009,30239,1540558451
6isgk0,The Queen reported to West Yorkshire Police for 'not wearing seat belt',True,1638,30221,1498124603
6dsnbd,Half of 8th grade class from New Jersey refuses to pose with Speaker Ryan,True,3456,30149,1495957002
83gc9p,A man found 54 human hands in the snow. Russia says they’re probably just trash,True,920,30106,1520701120
9u5j07,"Applebee's is betting on stress eaters, and it's paying off",True,2945,30073,1541354853
695e1z,Man who ordered gluten-free meal on flight is given a single banana – and cutlery to eat it with,True,3482,30026,1493870865
6nvmmw,Suicidal man doused in gasoline catches fire after police use Taser on him,True,1946,29952,1500321727
8wa7xt,Black US politician reported to police while canvassing for votes,True,10,29836,1530795365
7rr614,App concept records sexual consent in legally binding agreement,True,4003,29798,1516463988
950pfi,Women-only network appoints male chairman,True,2221,29764,1533557079
5uw7r1,Workmen's cafe overwhelmed with customers after it is accidentally awarded a Michelin star,True,1525,29757,1487472300
5y8mj5,Donald Trump officially names Obamacare replacement 'World's Greatest Healthcare Plan of 2017’,True,2469,29762,1488988056
7n2pih,Police nab 'Nigerian prince.' He's a 67-year-old guy in Slidell. Who knew?,True,1144,29702,1514654459
8p62f9,B.C. couple loses child custody after stuffed lion purportedly transmitting the word of God acted as their lawyer,True,1341,29410,1528333140
6a5esw,Town with brown water has no record of cleaning its water tower,True,1617,29353,1494336768
9nmkcx,Stephen Miller's third-grade teacher suspended after saying he ate glue as child,True,1914,29327,1539367341
7ieaz9,Japanese firm to use drone to force overtime staff to go home,True,1279,29321,1512731120
6y4wx5,Joel Osteen: Televangelist whose church closed during Hurricane Harvey tells victims not to have 'Poor Me' Attitude,True,2617,29271,1504577088
97c8ie,Bill Cosby Says Being Declared A Sexually Violent Predator Will Damage His Reputation,True,1442,29193,1534281104
8jnrw1,Fortnite Addiction Is Becoming a Problem for Major League Baseball,True,1086,29153,1526407979
5do26q,"Rick Perry is being considered for energy secretary, a position he wanted to eliminate",True,2935,29105,1479494542
6al6rz,Black actor in play about racism complains after police mistake him for drug dealer outside theatre,True,1125,29032,1494519871
4zul19,"Teenager on the run responds to police on FB, asks them to use better picture of her",True,1433,28976,1472310321
71o28j,Australia sends out same-sex marriage survey with barcode 'bumsex',True,842,28952,1506046659
6ef85x,Police: Thieves using blowtorch to steal from Everett ATM accidentally set cash on fire,True,1012,28946,1496240161
5sf6h3,Donald Trump's team 'holding meetings in the dark as they can't find right light switch in White House',True,2037,28922,1486398491
7hc0t5,"China Launches World’s First All-Electric Cargo Ship, Will Use It To Haul Coal",True,726,28811,1512331995
749b5k,Man's Jack Daniel's flag mistaken for ISIS flag by 'worried' neighbors,True,950,28815,1507134676
5u1uq8,"Pregnant women's bodies are 'hosts', says US lawmaker",True,4156,28799,1487095944
66medu,Michigan cops may soon be barred from having sex with prostitutes while undercover,True,1717,28770,1492740707
7ocyax,White noise video on YouTube hit by five copyright claims,True,960,28733,1515175278
7qelgs,Trump misquotes himself while claiming Wall Street Journal misquoted him about Kim Jong Un,True,1595,28629,1515963648
6ax52j,Star Wars villain Kylo Ren becomes fastest-rising baby name in the US,True,3166,28530,1494670735
5wupab,67-year-old man dies from heart attack after catching prized Pokemon 'Lapras' at MBS,True,958,28516,1488361937
8ghg1p,Police unsure if car dangling from Toronto bridge is part of movie shoot,True,657,28511,1525268156
67gf39,Nordstrom offering pre-dirtied jeans for $425,True,2480,28445,1493125661
7393zy,Alberta police dog accidentally fires handgun found after parking lot fight,True,1112,28418,1506704030
6n8gu1,Thousands sign up to clean sewage because they didn't read the small print,True,1107,28316,1500032243
8sjr4w,"Some Rivers Are So Drug-Polluted, Their Eels Get High on Cocaine",True,785,28177,1529512452
7p7ayo,"With ingestible pill, you can track fart development in real time on your phone",True,942,28166,1515506951
52vmfs,Man arrested for speeding in DeLorean at 88mph,True,949,28165,1473937548
7uukqs,"Man Uses $1m Win To Finally Visit Doctor, Gets Terminal Cancer Diagnosis, Dies Weeks Later",True,2016,28147,1517605960
97rxxv,"Police Use Taser on Woman, 87, Who Family Says Was Cutting Dandelions",True,1045,28133,1534423345
66haro,"Balenciaga's $2,145 bag is just like Ikea's 99 cent tote",True,1995,28120,1492690570
5popob,Trump’s press secretary has been fighting with Dippin’ Dots for 5 years,True,1698,28112,1485178376
a0ma2q,"FEC declares Kid Rock couldn't have run for senate as ""Kid Rock,"" thus clearing him of federal complaints",True,1166,28082,1543258706
779qlz,"Ted Cruz tweets Zodiac Killer confession, extending the internet's favorite meme",True,1160,28064,1508361339
5tthsl,US Department of Education misspells name of civil rights activist W.E.B Du Bois — then misspells apology tweet,True,1324,28067,1487000220
9pkcam,Radio ad in Arkansas suggests ‘lynching’ if Democrats win,True,1999,28059,1539959431
9syzdl,"Bitcoin mining could cancel out climate change efforts, scientists say",True,2833,28045,1540994443
8pqvcs,Florida Didn't Conduct Gun Background Checks for a Year Because an Employee Couldn't Log In,True,1214,28034,1528524410
91sx5h,"Uber can't keep down accusations of ""vomit fraud"" against its drivers",True,3268,27968,1532533215
6v53ze,'You will never be forgotten' headstone left behind at airport,True,431,27919,1503341704
9ii3p2,Man Survives Jumping Into Zoo's Elephant Enclosure as Animals Show Mercy and Escort Him Out,True,837,27776,1537797244
6ofh1u,Youth leader facing sex charges claims teen was 'keen as a jellybean',True,1955,27774,1500547965
6cqmdk,Cabinet member praises absence of protest in a country where protests are illegal,True,907,27719,1495492601
665h3e,Adidas Apologizes After Sending ‘You Survived’ Email to Boston Marathon Finishers,True,1193,27685,1492547387
6t8dfy,"Meanwhile, on Reddit, dudes can’t stop talking about fucking coconuts",True,961,27589,1502543770
7nuvst,Laid-off state employees being called back to staff unemployment compensation centers,True,1626,27570,1514988857
604f0u,Africa Trade Meeting Has No Africans After US Visa Denials,True,1638,27544,1489848466
9p48oe,Winnipeg's 1st toking and driving ticket issued 1 hour into legalization,True,1614,27484,1539822489
4xeuzf,Rio diving pool—still green—now closed and smells like farts,True,2330,27474,1471024670
8wfvl2,Facebook apologizes after labeling part of Declaration of Independence 'hate speech',True,2419,27408,1530839212
7opvqv,Japanese security firm finds success with guards dressed as ninja,True,682,27395,1515320039
68vrp5,Woman on trial for laughing during Jeff Sessions' confirmation hearing,True,3016,27384,1493757593
6b6s80,More states allow sunscreen at schools without doctor’s OK,True,2655,27385,1494802055
79uwyt,John Kelly: 'The lack of an ability to compromise led to the Civil War',True,5799,27362,1509446810
6ejl2a,Republican Congressman Says God Will 'Take Care Of' Climate Change,True,2840,27342,1496281232
60972o,Footballer accidentally thanks his wife and girlfriend in incredible man of the match speech,True,1265,27328,1489912963
49pqz3,Lawmakers sick after drinking raw milk to celebrate legalizing raw milk,True,3155,27298,1457552741
6x7jm0,"Seattle Times apologizes for not knowing where Alabama, Mississippi are located",True,2159,27221,1504193267
a5ahga,"Google CEO responds to Steve King's iPhone concerns: 'Congressman, iPhone is made by a different company'",True,1366,27208,1544559173
6baca8,I acted as a man to get work - until I was accused of rape,True,1440,27148,1494854466
6ned5q,Uk surgeon finds 27 missing contact lenses in woman’s eye,True,1522,27145,1500097521
a354pr,15-year-old activist accuses world leaders at UN climate conference of 'behaving like children',True,966,27121,1543959087
6w41qk,Netflix develops marijuana strains based on its original shows,True,920,27109,1503727489
5fec9y,Venezuela's currency now worth so little shopkeepers weigh vast piles of notes instead of counting them,True,3630,26968,1480368033
88o7es,Theatre-goer attacks ‘Roman soldier’ in a bid to rescue ‘Jesus’ from being crucified,True,1496,26967,1522555397
9tattj,"New Zealand thrash-metal band will miss Salt Lake City show, because they’re too young to enter a bar",True,954,26857,1541088727
6eqlq3,Wal-Mart Asks Employees to Deliver Packages on Their Way Home,True,2863,26790,1496358770
6n0oip,"Black teenage woman, mistaken for machete-wielding black man, alleges police brutality",True,4394,26772,1499940328
a64xjv,Man who stood in line to rob bank wearing mask and gloves wasn't queried because staff thought he may have skin condition,True,700,26746,1544795077
53nv4o,Australian man patents the Hamdog - a hotdog and burger combo,True,2082,26729,1474384900
9js3ss,Mother files federal lawsuit after son doesn’t make varsity team,True,2205,26678,1538179068
8fqus7,Chinese farmer unleashes 300 million hungry cockroaches to eat food waste,True,1430,26650,1525002256
8c17yu,"In a Leaked Memo, Apple Warns Employees to Stop Leaking Information",True,400,26493,1523642461
a8dps6,Video: SNES Classic Runs PSone Games Better Than The PlayStation Classic,True,1093,26350,1545421978
9gusc8,People stroll by as reporter ‘braces’ against wind. Weather Channel blames ‘wet grass’,True,1167,26309,1537276953
5q336i,'Lesbianism' listed as condition on North Carolina woman's medical chart,True,3190,26298,1485349955
5uf0r8,Martial arts academy posts how-to video for defending against Trump handshake,True,1099,26268,1487253041
76ytch,Woman becomes a princess after marrying Ethiopian prince she met in nightclub,True,911,26255,1508249761
6j5ujk,White St. Louis police officer shoots off-duty black officer,True,3965,26229,1498272565
9zqrbv,Man crushed to death by forklift truck driven by pet dog,True,668,26227,1542998061
827l3g,"Only 'thoughts and prayers' will stop evil behind shootings, Florida state senator says",True,2046,26201,1520270715
9qnkqx,Woman 'secretly fattened up bridesmaids before wedding',True,1726,26161,1540289646
5wgegi,Crystal Palace fans accidentally vandalise their own team bus,True,841,26149,1488197739
78pfbc,Japanese police arrest 74-year-old ninja thief suspect,True,896,26095,1508954126
9azojz,Tulsa Officer Acquitted of Killing Unarmed Black Man Holds Police Shooting 'Survival' Class,True,2502,26051,1535468742
6p6mtt,Fans are legitimately upset that Michael Phelps didn't race a real shark,True,1764,26042,1500877376
5tomyy,Man tweets Harry Potter book line-by-line to Piers Morgan,True,1758,25945,1486936968
765swt,Japanese zoo mourns anime-loving celebrity penguin,True,721,25942,1507911000
8zjatl,'Shock' as Vatican document says it is 'not essential' that consecrated virgins be actual virgins,True,1526,25920,1531814970
8ezxh7,Texas town holds .5K - not 5K - for underachievers,True,885,25900,1524716271
7oyj38,Chinese dating apps closed after women revealed to be robots,True,1248,25866,1515418494
60tpmj,Tillerson: 'I didn't want this job ... My wife told me I'm supposed to do this',True,2632,25726,1490176911
54470h,Anger as Churchill's home is turned into Hitler HQ for Transformers 5,True,2711,25705,1474629343
9anxvk,Thieves replace Paraguay police rifles with toy replicas,True,460,25573,1535367329
5v4jvb,Man marks his ex-girlfriend's apology letter and sends it back to her,True,2099,25544,1487597703
8u00rq,Second Spanish church falls prey to well-intentioned restorer,True,1013,25536,1530019831
a3km0s,Rapper Soulja Boy Releases New Handheld Game Console and It Looks Terrible,True,1470,25444,1544071245
5qod4i,Doctors save Canadian woman's life by removing her lungs for six days,True,1080,25427,1485620835
770cty,"Exclusive: Neo-Nazi and National Front organiser quits movement, opens up about Jewish heritage, comes out as gay",True,874,25412,1508263341
5byhmw,Canada's immigration website crashes on election night,True,1905,25417,1478666594
6pait5,'Don't get shot by police' is goal of new advice in Arizona driver's manual,True,2741,25397,1500922568
95wlde,The USMC would like you to know that being in armed combat is exactly like playing Super Smash Bros.,True,1297,25332,1533822582
5avoku,"Man searching for toilet stumbles across 49,000 year-old evidence of earliest human settlement in Australia",True,643,25330,1478163121
783kwo,Man given $149 ticket for singing 90s dance song while driving,True,1816,25323,1508712497
58dp12,Carjackers leave man's car behind after discovering it has a manual transmission,True,3087,25280,1476921429
8ts8vj,Finance boss stole £370k from his firm and bought kittens,True,467,25262,1529946633
6bva5t,"Cyclist celebrates stage win a lap early, goes on to finish 148th",True,500,25260,1495102483
9arzv3,"Bride cancels wedding, breaks up with fiancé after friends and family refuse to pay for $60G nuptials",True,2211,25213,1535398225
5ggefz,Donald Trump Tweets SNL Is ‘Totally Biased’ After Sketch About His Twitter Habit,True,1399,25206,1480871525
7y5y19,"'This Must Be Some Mistake,' Says Snowboarder After Winning Olympic Gold In Skiing",True,926,25175,1518863186
66pv0a,Alex Jones brags that he’s a “number one meme” during custody trial,True,2125,25118,1492788161
a85ntt,Sacha Baron Cohen’s ‘Who Is America?’ Deleted Scene May Have Exposed Elite Pedophile Sex Ring,True,2084,25105,1545361156
67n7cv,Gold Coast police urging victims to drop complaints to improve crime statistics,True,1038,25081,1493201671
77flfz,Viral Chinese video game measures which players can clap fastest for President Xi Jinping,True,1224,25063,1508431002
53hx5c,King of West African tribe returns to landscaping job in Canada,True,1147,24954,1474296872
5j6brj,Bill would block computers bought in S.C. from accessing porn,True,5361,24826,1482153428
7yv9w3,David Attenborough Themed Raves Are Taking The UK By Storm,True,616,24820,1519126955
74f8e1,Dead or Alive Xtreme PC will downgrade boob physics on low-end hardware,True,1404,24798,1507201631
6dw1ph,People with serious food allergies want impostors to stop faking it in restaurants,True,4163,24497,1496004213
8gopks,Qipao prom dress that caused a culture furore in the US draws head-scratching in China,True,5610,24434,1525334150
4vy51d,Suicide Squad fans petition to shut down Rotten Tomatoes after negative reviews,True,5105,24432,1470225898
5dg636,U.S.-born panda twins struggle in China as they know only English,True,712,24428,1479394207
51qybn,North Korea bans sarcasm because Kim Jong-un fears people only agree with him ‘ironically’,True,606,24410,1473336325
7us4e5,We regret to inform you that Rugrats now has a porn parody,True,1464,24383,1517586117
8ffbzm,Pizza delivery man gets $180K settlement after being crushed by 400 pounds of cheese,True,593,24362,1524865791
61z11x,Iceland witnesses record-breaking baby boom nine months on from humiliating England at Euro 2016,True,397,24335,1490704101
9vveuj,Gunman apparently stopped shooting to post online,True,2669,24305,1541865907
7gdund,Wisconsin DNR sold 10 hunting licenses to infants,True,1389,24195,1511967670
5v1quc,"Ryanair asks wheelchair user to walk up stairs, leaves her crying at the gate",True,3131,24188,1487554146
a1fif7,"Payless Opens Fake Luxury Store, Sells Customers $20 Shoes For $600 In Experiment",True,1888,24156,1543479451
7amqd5,"House Republicans claim an annual salary of $450,000 is middle class",True,2530,24117,1509747017
6uae67,Porn Site xHamster Wants to Produce ‘Sense8’ Season 3,True,1394,24096,1502980845
6euxnf,British Airways system outage 'caused by IT worker accidentally switching off power supply’,True,1197,24077,1496415984
a2eriz,Man crashes into tree after driving with his head out car window 'like Ace Ventura',True,387,24061,1543769327
9y71w7,ESPN: Browns want to interview former Secretary of State Condoleezza Rice for head coaching job,True,972,24042,1542556827
6uhr8a,Paris Hilton thinks she would have been social figure like Princess Diana if it weren't for sex tape,True,2538,24024,1503062360
8ltq14,UK believes Kremlin behind prank call to Foreign Secretary Boris Johnson,True,638,24017,1527177295
9oye1w,China Communist Party Kicks Out General Who Killed Himself,True,485,23994,1539780827
6d3aeq,Police: Man angry he can't pump own gas in New Jersey punches worker,True,4330,23956,1495643789
56vb16,"Perth man says 'thanks' after thief leaves money, removes problem stereo",True,1093,23948,1476144888
8ekjpo,Officer gives firefighter apology cake: ‘Sorry I tased you’,True,573,23945,1524577891
8fb20c,"Exorcisms booming as Christian faith declines and internet offers easy access to black magic, priests told",True,1394,23940,1524830079
7pm1za,Health Canada Warning Reminds Public Not to Eat Laundry Pods,True,1135,23891,1515649917
54civ2,Bike manufacturer sees huge reduction in delivery damage by printing TV on the box,True,904,23882,1474757711
5qu1nt,"Trump puts Bannon on security council, dropping joint chiefs",True,5188,23866,1485701075
6st3en,"Agencies advise on possible 'Lizard Man,' 'Bigfoot' sightings in South Carolina during eclipse",True,1850,23789,1502369544
6raala,Half of Detroit’s 8 mayoral candidates are felons,True,1922,23693,1501738898
7jliug,Write-in votes for Nick Saban may have swayed Alabama Senate,True,1698,23687,1513192204
837066,California Lawmaker Nicknamed 'Huggy Bear' Told to Stop Hugging People,True,1125,23677,1520605332
4wwob0,Derailed train car hits bar named 'DeRailed' in Iowa,True,499,23637,1470755693
5uadp5,Walmart is being sued for inventing a fake craft brewery,True,1822,23584,1487193809
7wttdv,School tells sixth-graders they can't say no when asked to dance,True,2237,23563,1518367530
8j0ely,"Judge can’t end a trial just because he has ‘heard enough,’ appeal court rules",True,578,23537,1526173303
6qi2we,U.S. government ordered to solve 'Case of the Incredible Shrinking Airline Seat',True,2326,23483,1501430166
