id,title,real,num_comments,score,created_utc
76rjtv,Man rescued from Taliban didn't believe Donald Trump was President,True,5328,103953,1508170551
923ww4,"Nat Geo hires Jeff Goldblum to walk around, being professionally fascinated by things",True,1552,100344,1532623554
9wl2d7,Black security guard who stops shooter is then shot and killed by police,True,2456,97228,1542077235
6cgr3h,Hunter dies after shot elephant falls on him,True,1729,95382,1495376413
7hs0t0,Mike Pence Once Ratted Out His Fraternity Brothers For Having a Keg,True,5322,92179,1512501459
8xirko,"Reddit CEO tells user, “we are not the thought police,” then suspends that user",True,6992,89674,1531184103
7otjwu,"R.I.P. astronaut John Young, the first man to get yelled at for smuggling a sandwich into space",True,1115,88494,1515361037
73oxkd,Trump dedicates golf trophy to hurricane victims,True,6822,85607,1506898189
80eui1,President Trump: I would have run into school during shooting ‘even if I didn’t have a weapon’,True,9442,83602,1519666872
8sg0sj,ICE Director: ICE Can't Be Compared To Nazis Since We're Just Following Orders,True,6285,75619,1529475290
6rsj7o,Uber’s search for a female CEO has been narrowed down to 3 men,True,6401,75484,1501948933
8etnji,"Dogs cannot get ‘autism’, British Veterinary Association warns after ‘anti-vaxx’ movement spread to pets",True,3134,74969,1524663841
8vpvoj,Somali Militant Group Al-Shabaab Announces Ban On Single-Use Plastic Bags,True,2024,74278,1530598089
7i0xl0,United Nations official visiting Alabama to investigate 'great poverty and inequality',True,6105,74094,1512592777
7z7ud1,Florida House declares porn a public health risk shortly after denying assault rifle ban,True,5844,73050,1519238072
7qucjv,Passenger turned away from two flights after wearing 10 layers of clothing to avoid luggage fee,True,3445,72983,1516127244
a5um6y,Congress To Make Members Pay Out Of Pocket For Sexual Harassment Settlements,True,1739,71633,1544715918
7p4drn,Sean Spicer says Oprah Winfrey Doesn’t Have the Political Experience to be President,True,6322,70154,1515469310
5pdqvm,White House press secretary attacks media for accurately reporting inauguration crowds,True,10815,69594,1485042136
7jx5td,"UPS loses Family’s $846K Inheritance, Offers to Refund $32 Shipping Fee",True,3169,69585,1513309279
9qfrz1,School boy takes MICROWAVE to school to carry books after school bans bags,True,3090,67955,1540227967
7ue4eg,Teen suspended from high school after her anti-bullying video hurts principal's feelings,True,3118,67902,1517439694
84pv7l,Alabama lawmaker: We shouldn't arm teachers because most are women,True,3957,67663,1521147002
7ec1pg,"Marilyn Manson Mourned On Twitter, Confusing Him For Dead Mass Murderer Charles",True,3350,67609,1511210989
7fxz37,Trump calls Warren 'Pocahontas' at event honoring Native American veterans,True,3969,67347,1511812928
7f1kxc,Cat named after Notorious B.I.G. shot multiple times — and survives,True,2028,66826,1511462180
7epgmr,"No, this isn't The Onion, Yes Net Neutrality is under attack and we have less than a month to save it. Fight to save Net Neutrality today!",True,669,66599,1511339556
9cwi0q,Saudi Arabia declares online satire punishable offence,True,1501,66212,1536073922
7xm3fq,EPA Head Says He Needs to Fly First Class Because People Are Mean to Him in Coach,True,717,65047,1518648886
7czknr,Cards Against Humanity buys plot of land on U.S./Mexico border to block border wall,True,4993,64814,1510700164
7dblzz,Apology after Japanese train departs 20 seconds early,True,3077,64722,1510828963
6on1su,Justin Bieber banned from China in order to 'purify' nation,True,3146,64613,1500632590
7l2fiv,Alcohol level in air at fraternity party registers on Breathalyzer,True,2004,64405,1513787045
8oq62o,"Always look on the bright side of life, says CEO who raised EpiPen price by more than 400%",True,1011,64281,1528199508
7vognj,Trump calls Dems who didn't clap during State of the Union 'treasonous' and 'un-American',True,8017,64258,1517934342
6lffoc,"NPR tweets the Declaration of Independence, and people freak out about a ‘revolution’",True,7418,64019,1499275046
8suhhk,"Melania flew to Texas to visit immigrant children wearing a jacket that says 'I really don't care, do u?'",True,3811,62175,1529607152
6f4vk9,Man who mowed lawn with tornado behind him says he 'was keeping an eye on it.',True,1613,61488,1496540657
82qinj,Michael B. Jordan buys teen a new retainer after she bit through it during his shirtless Black Panther scene,True,1935,61113,1520447312
a70akr,"Missouri man must watch ‘Bambi’ monthly as part of poaching punishment, judge rules",True,1763,60869,1545057171
7cm6r5,Ferry McFerryface to be name of new Sydney ferry after public vote,True,1889,60818,1510567779
6dfsd7,British politician wants death penalty for suicide bombers,True,3149,60645,1495788899
97b7ai,Missouri Republican Who Said ‘Hitler Was Right’ Wins State House Primary,True,3214,60204,1534273791
8zb638,US Republicans endorse arming toddlers on Sacha Baron Cohen show,True,5661,60177,1531749888
8xquao,"A man harasses a woman for wearing a Puerto Rico shirt, saying it's 'un-American'",True,4891,60095,1531240281
a7uv1r,"France Protests: Police threaten to join protesters, demand better pay and conditions",True,3582,59705,1545284545
9xrdj2,Texas Students Will Soon Learn Slavery Played a Central Role in the Civil War,True,3984,59665,1542410710
81gusw,The number of Delta Air Lines passengers who bought tickets with NRA discount: 13,True,3787,59008,1520017551
7aqklg,Alt-Right White Supremacists Claim Papa John's as Official Pizza,True,7029,58963,1509801432
6un2rj,White supremacists taking DNA tests sad to discover they’re not 100% white,True,5238,58919,1503116537
84w1f8,"After eating Chipotle for 500 days, an Ohio man says he's ready for something new",True,2478,57838,1521212297
7szhgm,‘El Chapo’ promises not to kill any jurors from upcoming federal trial,True,3219,57084,1516915437
8s0yx3,Poll: Kim Jong Un has higher approval among Republicans than Pelosi,True,5613,57078,1529340163
7x12r0,"After 4th DWI, man argues legal limit discriminates against alcoholics",True,3866,56949,1518445792
6ptftc,"Since Jay-Z put out an album called 4:44, Jersey prog band 4:44 put out an album called Jay-Z",True,1089,56896,1501127320
a4enl9,School turns students' lunch debt over to collection agency,True,4884,56731,1544303698
6dzu2h,Palestinian judge bans divorce during Ramadan because ‘people make hasty decisions when they’re hungry’,True,2789,56568,1496058508
8bicsf,Argentinian officers fired after claiming mice ate half a ton of missing marijuana,True,1274,56337,1523463653
4z07o6,"Harambe: Stop making memes of our dead gorilla, Cincinnati Zoo pleads",True,4862,55689,1471867614
5zlct1,"Jeff Sessions: Marijuana Is ""Only Slightly Less Awful"" Than Heroin",True,7258,55516,1489604329
6ftvco,DC bars to open early for Comey hearing watch parties,True,3766,55383,1496846745
7sn5k6,Former Barney the Dinosaur actor now works as a controversial tantric sex guru,True,2376,55131,1516801471
6shoh1,Trump gets a folder full of positive news about himself twice a day,True,4116,54743,1502236861
9022wd,“An almond doesn’t lactate:” FDA to crack down on use of the word “milk”,True,4157,54606,1531969212
7qpq3u,NYPD Union Sues To Stop Release Of All Bodycam Footage Because It Violates Officers’ Civil Rights,True,4907,54489,1516075630
a0zba8,Massive cow named Knickers has been deemed too large to eat,True,2183,54442,1543354516
6boqaw,EU warns Turkey after it violates Greek airspace 141 times in one day,True,749,54356,1495028237
96hi5z,The man who stole a plane said he didn't need much help: 'I've played some video games',True,3792,53962,1534002597
5w07ne,"White House blocks CNN, BBC, New York Times, LA Times from media briefing",True,2789,53870,1487971458
6o4ids,'Nobody kill anybody': Murder-free weekend urged in Baltimore,True,2146,53827,1500419377
9irn5c,"Texas prisons deny dentures to inmates with no teeth, claim chewing 'isn't a medical necessity'",True,3565,53820,1537878147
7a4oyr,"Papa John's blames NFL, anthem protests for falling pizza sales",True,8499,52590,1509553693
6ktzx1,Teacher Of The Year In Oklahoma Moves To Texas For The Money,True,4860,52428,1499011659
8kzq7k,Pakistani girl who died in Texas shooting ‘wanted to experience American culture’,True,2145,51734,1526897579
7m24z1,Suspected murderer who evaded capture for 12 years by pretending to be mute loses voice from underuse,True,1417,51419,1514219223
7hndqf,Thousands unfollow Sen. John McCain after he asks for more Twitter followers,True,2330,51334,1512449154
7rkbu1,"Texas judge interrupts jury, says God told him defendant is not guilty",True,1920,51280,1516386082
8yjy7n,"Speeding Arizona Congressman Claims 'Immunity' When Pulled Over, Brags to Cop He Goes Even Faster",True,3151,51123,1531488330
9iwvod,Bill Cosby Gets Vanilla Pudding in Jail for First Meal Behind Bars,True,2762,51104,1537915360
6k4ovj,Fox News isn’t worried about millions losing insurance since “we’re all going to die”,True,5152,51054,1498694690
a9zlxv,Macaulay Culkin to legally change his middle name to Macaulay Culkin,True,2478,51049,1545920646
99gqbd,The creators of the Nintendo 64 GoldenEye have officially ruled: Oddjob is cheating,True,1761,50993,1534968892
82fug2,Bush says Trump ‘makes me look pretty good’ by comparison: report,True,3780,50832,1520349878
9x6f8b,Iceland's president admits he went 'too far' with threat to ban pineapple pizza,True,2251,50826,1542245315
68fcab,"Merriam-Webster adds ""sheeple"" to dictionary, cites Apple users as an example",True,3445,50717,1493557250
7511p5,'We want sauce': police called after McDonald's Rick and Morty promotion heats up,True,4738,50467,1507459697
79nb46,France Is Running Out of Butter for Its Croissants,True,2518,50297,1509365739
7mz5un,Utah teacher fired after showing students classical paintings which contained nudity,True,3771,50100,1514603582
6jdwlq,American man was arrested for scamming Nigerians of over N150 million,True,911,49940,1498390963
91bhsd,Police: Naked Man Arrested At Planet Fitness Cites ‘Judgment Free Zone’,True,2142,49866,1532383588
9n9wu4,First Lady Melania Trump Says She Is 'the Most Bullied Person in the World',True,4009,49855,1539264083
6no7ll,Ohio State fan in coma asked if he likes Michigan responds 'No',True,1527,49854,1500234400
724atl,Saudi Arabia accidentally prints textbook showing Yoda sitting next to the king,True,979,49806,1506248117
86zyb8,"“Japan’s slowest roller coaster” derails, passengers don’t notice",True,758,49763,1521974097
64sw45,"'Even Hitler didn't sink to using chemical weapons', says Spicer of Syria attack",True,5454,49687,1491937044
966rje,"Texas woman arrested for marijuana takes mugshot, gets requests for makeup tips",True,3754,49541,1533906419
8b9jfv,Drunk tourist accidentally climbs mountain while trying to get back to his hotel,True,1042,49467,1523381582
6zn3b5,‘Drunk’ tourist thought to be the first person to survive swim across Hoover Dam,True,2817,49194,1505224581
7j6zp7,Judge orders Alabama not to destroy voting records in Tuesday's Senate election,True,2699,49147,1513040971
9m5e1j,Moray rapist who tried to cheat justice by claiming he was too fat to appear in court died of heart disease,True,1674,49116,1538922242
7jdiqf,"In final-hour order, court rules that Alabama can destroy digital voting records after all",True,3477,48790,1513109138
8mzsj8,"Please Don't Roast Marshmallows Over the Erupting Hawaii Volcano, USGS Warns",True,1202,48633,1527606304
8ucmd7,"Families earning $117,000 now qualify as ""low income"" in California's Bay Area",True,5013,48602,1530128049
9dvg12,Fox Business Host Calls Former President George W. Bush a 'Radical' Liberal,True,3702,48432,1536334211
5z4it6,Kellyanne Conway suggests Barack Obama was spying on Donald Trump through a microwave,True,5046,48156,1489405523
5fivpv,Jill Stein raised more money for her recount effort than she did during the election,True,4806,47488,1480429344
7lsuv3,TSA agents are apparently still confused as to whether the District of Columbia is in the U.S.,True,4351,47213,1514084476
60o4p6,FBI director James Comey admits under oath that he hates the Patriots,True,2255,46794,1490109089
7to0wy,"Florida is the worst state in the nation in every way, new rankings say",True,3550,46584,1517181946
7bwrco,'Mary Was a Teenager.' Alabama Republican Uses Jesus to Defend Roy Moore,True,5428,46579,1510265433
71x3fz,Hurricane victims call sex hotline after FEMA mistakenly tweets wrong number,True,569,46451,1506154180
78fuic,The world's oldest living land creature is a gay tortoise named Jonathan,True,1827,46336,1508852949
82m4ln,"Over 500 Canadian doctors protest raises, say they're being paid too much",True,2110,46297,1520403013
6u2qxs,Woman gets lifetime bus pass for 103rd birthday,True,1637,46234,1502896976
8l8tuf,Family says supermarket wouldn't write Summa Cum Laude on a cake due to profanity,True,3414,46014,1526983271
8me5pn,"US lost track of 1,500 immigrant children, but says it's not 'legally responsible'",True,2515,45972,1527379176
6ygt06,Candidate for Charlotte mayor puts 'white' among qualifications,True,5008,45657,1504716259
94jdww,"Amish man launches ""Uber"" ride service with his horse and buggy",True,1014,45658,1533391842
7dlxxc,Man finds car 20 years after forgetting where he parked it,True,1483,45527,1510934677
93vmm4,"Keeping Up With The Kardashians may make viewers cold-hearted towards poor, study suggests",True,2066,45475,1533178896
7yjgwh,2 kids dressed as 'tall man' unable to gain admission to 'Black Panther',True,945,45380,1519007832
7x8taz,Facebook is suggesting mobile users 'Protect' themselves...by downloading a Facebook-owned app that tracks their mobile usage,True,2004,45240,1518521892
84imf1,Sheriff who pocketed $750K from inmate food fund bought beach house for $740K,True,1729,45214,1521075714
93zpwv,"'I was annoyed': Woman, 95, shoos black bear out of kitchen twice in one day",True,864,45170,1533219971
70cxib,"Sign language interpreter used gibberish, warned of bears, monsters during Hurricane Irma update",True,2591,45155,1505511267
92hmjk,"Juncker used ‘brightly coloured, simple flashcards’ to explain trade to Trump during meeting",True,2857,45140,1532735245
85b4dn,Cop Does Not Shoot Unarmed Man,True,1762,45051,1521378604
5t46ur,Man Creates Tinder-Like Dating App Where He’s the Only Guy Available,True,1279,45024,1486687927
8n92t8,Ambien-maker to Roseanne: Racism is not a side effect of our drug,True,2427,44710,1527690983
981dvj,"Senate adopts resolution declaring ""the press is not the enemy of the people""",True,3241,44682,1534504340
5kmshn,Man launches GoFundMe page to ‘protect Betty White from 2016’,True,1686,44576,1482880537
8jhv1e,"Ex-Chipotle manager, accused of stealing $626, gets $8 million for wrongful termination",True,1940,44506,1526349319
6mldbk,Man checks in a can of beer as only luggage on Perth bound flight,True,1380,44420,1499769218
5hr3th,Donald Trump says he doesn't need daily intelligence briefings as President because he's 'smart',True,442,44233,1481476830
9kqpsr,"Cruise Ship Refunds Passengers After 1,300 Men Took Over and Turned It Into a Giant Burlesque Show",True,1497,44213,1538487791
85kr59,Flight Attendant Orgy Denied By Airline Despite Being Caught On Camera,True,2556,43928,1521476688
7in9jo,Six Flags cancels massive snowball fight due to ... real snow,True,894,43811,1512832926
5ssl8y,Fire breaks out at Chinese factory that makes Samsung Note 7 batteries,True,1578,43817,1486559539
62o1uz,President Donald J. Trump Proclaims April 2017 as National Sexual Assault Awareness and Prevention Month,True,6296,43805,1490993641
7xeeze,"Pastor was ‘counseling’ the young, naked man tied up in his car, he says",True,1607,43580,1518571360
6h3m5i,Remorseful husband who robbed bank to escape wife sentenced to home confinement,True,816,43535,1497395359
700xcc,Zach Braff Discovered He’s Being Used To Advertise Erection Pills In Ukraine,True,798,43467,1505377402
6h7xja,House hearing on gun legislation canceled after shooting,True,47,43243,1497451480
92mf1t,"Google Says It Will Stop Android Phones From Suggesting ""My Face"" When Users Type ""Sit On""",True,1221,43143,1532787336
69lhk3,Labrador: ‘Nobody dies because they don’t have access to health care’,True,5267,42617,1494081343
8pm20x,"Trump says he may pardon Muhammad Ali, who does not need a pardon",True,2292,42423,1528480689
99yln9,Couple Couldn't Conceive Because They'd Been Having Sex the Wrong Way for Four Years,True,5127,42171,1535126151
62dv0w,"Donald Trump 'feels great' about criticism of spending millions on Mar-a-Lago trips, says Sean Spicer",True,7066,42061,1490879712
714v68,"Losers are more likely to believe in conspiracy theories, study finds",True,3621,41936,1505844503
7i6mo0,The Room's Tommy Wiseau Wants to Make a Star Wars Movie,True,2323,41865,1512655274
8xzx2c,Texas couple considering divorce to help pay for daughter's health care costs,True,4339,41852,1531318372
a9desh,"Air Canada flight turns back halfway to Hawaii, passengers get $10 vouchers",True,1787,41833,1545727034
89d68g,Japanese couple apologise for ignoring work pregnancy timetable by conceiving ‘before their turn’,True,2515,41651,1522758282
7mqap0,People keep uploading Hamilton to PornHub,True,1761,41581,1514503281
98b0gu,"Red Bull and vodka is scientifically proven to start fights, study says",True,1278,41469,1534591491
5wair1,Fox News's 'Swedish defence advisor' unknown to country's military officials,True,2235,41412,1488122283
6m0vl0,Putin points at journalists and asks Trump 'Are these the ones hurting you?' during press conference,True,4532,41173,1499519303
7kjz6f,Surgeon admits to branding initials on patients' livers,True,2430,41092,1513585618
7ypvet,Roseanne Barr says Fergie's national anthem performance was worse than her 1990 rendition,True,3387,41075,1519072374
6xlycq,Library asks people to stop paying fines with Chuck E. Cheese tokens,True,731,40783,1504359206
6x2ks5,Joel Osteen Says He Didn't Open His Church for Shelter From Harvey Because Nobody Asked Him To,True,3601,40525,1504130237
81apih,Hundreds of people gather to say ‘wow’ like Owen Wilson,True,886,40514,1519954693
9ey4nt,Taco Bell voted best Mexican restaurant in the country,True,3727,40509,1536676804
9gksky,City won't fix laneway because it's owned by a man who's been dead for 118 years,True,1153,40298,1537194569
815655,"Austrians can swear or make obscene gestures at politicans, court rules",True,1217,40218,1519910266
5vqp2f,YouTube cuts popular live stream of giraffe about to give birth for ‘nudity and sexual content’,True,1608,40189,1487860513
a8tyrz,Man whose wife has cancer gets help to pay bills by winning $100K lottery prize,True,2097,39935,1545564019
a2rwix,"Decriminalization of Domestic Violence Was a 'Mistake,' Russian Official Admits",True,1730,39599,1543864636
7o238z,Some Oregonians in Panic Mode After Law Allowing Motorists to Pump Their Own Gas Takes Effect,True,7486,39498,1515060843
7x4w3d,"Police officer fired for not shooting black suspect wins $175,000",True,2744,39492,1518476786
71ca29,Death Wish Coffee recalls cold brew cans due to potentially deadly toxin concerns,True,1572,39421,1505925250
7pccil,"Pastor admits to ""sexual incident"" with teen 20 years ago, gets standing ovation",True,4770,39406,1515550378
6bhqsq,Thailand threatens to sue Facebook after videos emerge of king in crop top wandering in German shopping centre,True,2196,39082,1494944440
6q4afd,Utah woman killed on cruise ship during murder mystery dinner,True,2490,39075,1501253618
86k1df,Superintendent Says Students Are Armed with Rocks In Case of a School Shooting,True,3569,39039,1521806153
8257en,Big Cheese festival apologises for running out of cheese,True,1041,39025,1520248052
6xr2ik,"Wisconsin sends 17,000 pounds of cheese to Houston",True,1502,38862,1504411068
8465f2,A startup is pitching a mind-uploading service that is “100 percent fatal”,True,3309,38663,1520963366
4em513,Military veteran frustrated he has to annually fill out form to say his legs are still missing,True,1565,38552,1460562096
5obw53,This Republican politician allegedly told a woman 'I no longer have to be PC' before grabbing her crotch,True,5207,38457,1484585734
8wvi37,Florida cop claims Burger King put dirt on his food — investigation reveals it was seasoning,True,1687,38401,1530990225
8ksvlt,El Paso woman living in Montana detained by Border Patrol for speaking Spanish,True,3843,37920,1526825944
6kej8v,We Do Not Have a Child Slave Colony on Mars: NASA,True,2960,37868,1498808932
69gpah,Ukraine bans Steven Seagal as threat to national security,True,1768,37709,1494011758
5f2bhj,"People have paid a company more than $80,000 to dig a hole for absolutely no reason",True,2406,37667,1480203304
9k02lz,No one shot in Chicago in 22-hour span,True,1443,37299,1538251480
6z8p33,A woman was told to stop speaking 'foreign muck' but was actually speaking Welsh... in Wales,True,1867,37263,1505055855
86dy1h,YouTube gun ban drives bloggers to PornHub,True,3460,37235,1521744194
7xytmz,People are walking into glass at the new Apple headquarters,True,1695,37222,1518788952
9rz0rm,"50 Cent says he bought 200 front-row tickets to a Ja Rule concert, just so they'd be empty",True,1476,37151,1540684974
5g41kz,Venezuela's currency value depends largely on one guy at an Alabama Home Depot,True,2577,36905,1480694932
5wos0h,Betsy DeVos labels Black Colleges 'pioneers of choice' despite being set up for African-Americans with no options,True,2694,36889,1488297582
9f8rmu,North Carolina didn't like science on sea levels … so passed a law against it,True,2169,36865,1536766218
895jfb,Spaniard raised by wolves disappointed with human life,True,1337,36736,1522705063
8hwm3y,Delaware on verge of being first U.S. state to ban child marriage,True,2394,36693,1525785563
80xluv,Fake news: The Onion's fake headline about Cleveland's sewer system is actually true,True,911,36677,1519837466
9i9idw,Canadian politician says a family can eat on $75 a week,True,7066,36561,1537719025
9c8p7c,Police say 'Free Candy' van not a threat to public,True,877,36477,1535854447
7zqu83,FCC chair Pai receives NRA gun award for courage,True,2066,36466,1519415079
9ysoqk,Massachusetts mayor first in line as recreational marijuana sales begin,True,1031,36421,1542724554
75wajx,Woman almost dies after unborn baby kicks a hole in her womb,True,2873,36412,1507806713
5d2s4x,Apple's $300 book contains 450 photos of Apple products,True,4975,36407,1479220352
8sqnit,Japanese worker punished for starting lunch three minutes early,True,2700,36324,1529575514
9wst2f,Wells Fargo: Shareholders can't sue us because they should have known we were lying,True,1225,36315,1542141100
8qhgq4,Russian workers are undergoing training to learn how to smile ahead of the World Cup,True,1756,36310,1528794178
97vxkb,Fox News Mistakenly Uses Photo of Patti LaBelle in Aretha Franklin Tribute,True,1365,36302,1534451768
78br41,Michael Bay to Produce Live-Action ‘Dora the Explorer’ Movie,True,1992,36216,1508801017
a4xcol,Universities launch drive to recruit more white males as low numbers give them 'minority group' status,True,1417,36214,1544460746
76nd64,Man fed up with nagging wife hides in forest for 10 years,True,1309,36213,1508118965
6tlk99,Charlottesville photo: Man shouting angrily at white supremacist rally insists he is not 'an angry racist',True,7669,36190,1502706729
95p3ve,Georgia defends voting system despite 243-percent turnout in one precinct,True,1651,36171,1533755963
6ilnac,"Gunman kidnaps family, forces them to shop at Target",True,1710,36124,1498049867
8b0l4n,Montreal mother told daughter doesn't count as 2nd passenger in carpool lane,True,2783,36035,1523297423
6rer6l,Police planned to sell crime victim's car at auction instead of returning it,True,1847,35998,1501788280
6me9rb,Patients whose emergency surgeries are delayed have higher risk of dying: study,True,1910,35968,1499691457
6qnyqt,One in eight young people in the UK have never seen a real cow,True,3140,35883,1501502608
8usr1c,Wisconsin man injured after upskirting shoe camera explodes,True,1358,35869,1530275461
79ycar,"Pope Francis admits: 'When I pray, sometimes I fall asleep'",True,1010,35801,1509479489
8lifn6,Man mistakenly runs full Fargo marathon instead of half,True,1223,35692,1527073154
908fsr,"Jenny McCarthy doesn't know what her Google Home sounds like, assumes it's a ghost",True,1793,35661,1532024988
8kf35a,"Using emojis to teach Shakespeare will not help disadvantaged students, says head",True,912,35602,1526665721
9vqazy,George RR Martin: ‘When I began A Game of Thrones I thought it might be a short story’,True,1274,35431,1541813245
68ry1o,Protesters throw Pepsi cans at police during May Day demonstrations,True,2462,35052,1493714037
6foh0c,"Putin: 'I am not a woman, so I don’t have bad days'",True,2480,35020,1496780413
99so6s,Florida candidate says alien abduction doesn’t define her,True,1230,35021,1535069590
7abg6v,Rick Perry suggests fossil fuels help prevent sexual assault,True,2094,34980,1509628928
8zlan8,"Mgm Resorts Sues More Than 1,000 Las Vegas Shooting Victims To Avoid Liability In Massacre",True,2765,34945,1531835524
62t4jm,"Without Obama, once-booming gun industry poised to shrink",True,6001,34905,1491058047
6y7rr3,Putin on US administration: 'It’s difficult to talk with people who confuse Austria and Australia',True,1570,34841,1504616016
6ow59m,Sean Spicer stole a mini fridge from Junior White House staffers,True,1404,34831,1500743722
54tleo,Anti-Defamation League Declares Pepe the Frog a Hate Symbol,True,4183,34797,1475020320
8k9b7u,All of Mugshots.com’s alleged co-owners arrested on extortion charges,True,1952,34721,1526605201
