id,title,real,num_comments,score,created_utc
7jzcx3,Jeff Bezos Named Amazon Employee Of The Month,False,12,941,1513340376
8eljy3,"‘The Name On My Birth Certificate Is Actually “The ‘Dwayne Johnson’ Rock,” But People Always Get It Mixed Up’: 5 Questions With Dwayne ‘The Rock’ Johnson",False,12,941,1524585859
a5tcqp,Slovenian 8th-Graders Surprised Even They Outperformed U.S. Students In Science,False,21,941,1544706582
99okt9,Incredible Life Hack: The Wealthy Are Now Buying Spots In Heaven From The Church Before They Die,False,31,947,1535039837
6o1fq8,Presidential Fitness Test Now Awarded To Any Kid Who Can Eat Without Sweating,False,15,942,1500391360
9mzdt8,Teacher Who Dedicates Life To Students Total Fucking Bitch,False,16,931,1539177517
8zwg97,Baby Steps: China Has Finally Made It Illegal To Chain A Live Bear At The Front Of Your Driveway And Surgically Attach A Mailbox On Its Head,False,18,935,1531927561
7ja3eh,Time-Traveling Hillary Clinton Warns Self To Do Everything In Exact Same Way,False,22,935,1513077338
9ezfaq,Nation Longing For Simpler Time Of Knowing Exactly Who They Wanted To Kill And Why,False,26,928,1536685774
5yn3th,News: Not Messing Around: J.K. Rowling Just Threatened To Write A Short Story Where Harry Potter Drowns In A Septic Tank At Woodstock ’99 If Fans Don’t Do Something Big For Her Birthday,False,31,927,1489164252
9xbgzi,Worldwide Jewish Conspiracy Worried It Came Down Too Hard On Jeff Yesterday,False,9,932,1542290925
9ue92q,More Americans Concerned Illegal Immigrants Will Take Their Spot On Couch,False,8,927,1541430375
a855tc,Only Adult Left In Trump Administration Named ‘Mad Dog’,False,19,928,1545357226
9ijk3t,"BREAKING: Wait—Sorry, False Alarm",False,10,926,1537807562
6r6e1s,Experts Warn Repeated Attempts At Eradicating Obamacare May Have Created Ultra-Resistant Super Law,False,7,929,1501699875
7yw0tt,Man Worried Any Crazy Person Could Get Hands On Congressional Seat,False,6,919,1519134820
4vss84,Dad Suggests Arriving At Airport 14 Hours Early,False,10,919,1470149164
7cgwmn,World Doesn't Even Know Who To Admire Anymore After Tom Hanks Murders 5,False,13,915,1510509642
8jv4zb,Trump Boys Set Up ‘Don And Eric Law Place’ In White House Electrical Room To Help Dad With Legal Problems,False,11,912,1526479268
9hrc6t,College Freshman Has Friend From Home Visiting Way Too Soon,False,7,917,1537545672
9qczpm,Melania Trump’s Plane Forced To Make Emergency Landing After Smoke Begins Billowing Out Of First Lady,False,12,915,1540208198
a7b2sr,KFC Blames Popeyes For Releasing Serial Rapist From Prison In New Attack Ad Campaign,False,16,911,1545139901
6wir31,‘Game Of Thrones’ Viewers Reeling After Finale Unexpectedly Kills Off Fan,False,2,915,1503919216
7eatz8,Report: Only 3% Of Conversations Actually Need To Happen,False,11,912,1511201622
87j7ng,Report: Sharks To Only Kill 10 People This Year But One Of Them Will Be You,False,16,903,1522163816
a9omn1,Brad Pitt Stumbles Across Old Cardboard Box With Gwyneth Paltrow’s Head In Attic,False,7,901,1545831566
819131,PornHub Expands Parental Controls For User Accounts,False,15,903,1519940566
a7y0jn,Man Googling ‘Tender Lump On Neck’ About To Begin Exciting New Phase In Life,False,13,899,1545313203
9g1xkk,Why Do All These Homosexuals Keep Sucking My Cock?,False,15,895,1537022209
862p0i,Report: Snoring May Increase Risk Of Having Throat Slit During Night By Loved One,False,8,894,1521644049
a4w7r9,Study Finds 79% Of Statistics Now Sobering,False,3,895,1544452975
86c6x8,Man Constantly Blaming His Problems On Fact That He’s On Fire,False,13,891,1521731261
9vksa5,Pistachio-Eating Man Achieves ‘Flow’ State,False,15,893,1541773137
87x1wg,Man Confidently Hits ‘Send’ On Worst Job Application Company Has Ever Seen,False,12,890,1522283665
93ppe1,Heartbreaking: A ‘Price Is Right’ Contestant Just Won A Dryer That Drew Carey Has Clearly Been Living In,False,6,883,1533135645
9dj9hv,Fabled Lost City Of Gold Finally Discovered Off I-95 Outside Baltimore,False,12,886,1536244870
7e3p65,Fox News Struggling To Attract Younger 60-75 Demographic,False,8,884,1511127447
9krd8u,Chuck Grassley Scratches ‘Christine Blasey’s A Slut’ Into Senate Bathroom Stall,False,23,885,1538492513
80f703,Priest Regrets Vow Of Celibacy After Learning About Furries,False,20,877,1519669413
a4cafe,George H.W. Bush Remembered For Vast Contributions To AIDS Quilting Community,False,14,880,1544287987
9oh47v,Elizabeth Warren Disappointed After DNA Test Shows Zero Trace Of Presidential Material,False,26,883,1539639445
8n9jau,Major Breakthrough: IBM Claims That By 2020 Watson Will Learn The Difference Between Lame Whale Facts And Cool Whale Facts,False,12,880,1527694513
7uawql,"News: You Go, Girl: Just 3 Weeks After Her Badass Golden Globes Speech, Oprah Has Become The Dictator Of Venezuela After Leading A Successful Military Coup",False,5,872,1517414569
96981k,Courageous Heterosexual Has Never Donated Blood To Red Cross In Solidarity With Gay Men,False,20,869,1533923713
965mw7,Smash Bros ultimate will allow characters to punch themselves in the face to freak out opponents,False,10,863,1533895402
95119e,The Problem With ‘The Flash’: Why Doesn’t Flash Have Bugs Splattered On His Face After Every Time He Runs Really Fast?,False,24,871,1533560057
8xqd65,Disaster Imminent: This Kid On A Road Trip Has A Full Bladder And Just Got To The Funniest Part Of ‘Nacho Libre’,False,11,866,1531237453
7rxr6b,Looking Back On The Worst 365 Days Of Donald Trump's Presidency,False,12,854,1516542419
9y8010,Pope Francis Pursues Sinner Across Vatican City Rooftops,False,12,849,1542563339
9jddzk,Kavanaugh Scores Keg For Christine Blasey Ford Testimony,False,20,848,1538058873
9rbqhq,14-Hour Labor Not Exactly Cakewalk For Baby Sticking Halfway Out Mother’s Vagina Either,False,5,846,1540484134
9oo93u,Mother's Little Angel Just Made Fun Of Classmate's Weight For 30 Straight Minutes,False,6,848,1539701022
9ixgi0,Ethical Hunter Throws Duck He Shot Back Into Sky,False,4,844,1537920028
a3nho0,"Wisconsin Legislature Weakens Incoming Democratic Governor By Restricting His Access To Food, Water, Shelter",False,3,844,1544099772
810hao,Delta Pilot Refuses To Land Until Gun Control Legislation Passed,False,13,836,1519858683
6i74xi,Life: Fuck It: Let’s Rank The Religions,False,37,839,1497886255
9jsdj7,Wealthy Teen Nearly Experiences Consequence,False,6,836,1538181486
8d0ous,Alex Jones Pleads With Sandy Hook Parents To Imagine Pain An Expensive Lawsuit Would Cause Him,False,26,832,1524004332
a2016u,Meet The Brilliant 12-Year-Old Hacker Who Breached The Bud Light Website’s Impregnable Age Verification Firewall,False,6,828,1543639566
9lyrd4,Pussy-Hat-Wearing Jeff Flake Spotted Protesting Outside Senate Ahead Of Voting Yes For Kavanaugh,False,16,825,1538854175
8b7z74,"‘You Are Donald Trump, 45th President Of The United States,’ Trump Reads From Faded Tattoo On Wrist",False,35,825,1523370682
575d1i,Badass Surgeon Puts On Fingerless Latex Gloves Before Operating,False,1,824,1476293819
9ld2ih,Silent Hero: This Dog Has No Idea It Is Single-Handedly Supporting Nearly Every Conversation At This Party,False,3,821,1538668043
8ayyx2,New Honda Commercial Openly Says Your Kids Will Die In A Car Crash If You Buy A Different Brand,False,14,815,1523285312
6mfnvq,"Life: Heartwarming: After This Teen Died From Cancer, The Rock Stepped Up And Took The Blame For All The Pornography Found On His Computer",False,7,816,1499705192
9na3l5,High School Suspends Hunky Student For Wearing Shirt,False,14,809,1539265571
a9p0jw,Tom Hanks Vows He Won’t Stop Until He Has Portrayed Every Last American,False,5,809,1545834909
a654fp,Bus Rider Acting Like Fight Not Happening 4 Feet Away,False,9,808,1544796581
a7j269,Man Finally Able To Forgive Self For Terrible Mistake He Made 2 Seconds Ago,False,16,808,1545193782
742zlf,News: Taking A Stand: Congress Has Passed A Bill Making It Illegal To Sell Firearms To The Las Vegas Shooter,False,26,804,1507060947
a35xom,Trump Boys Raid Sister’s Closet For Sexy Clothes They Can Use To Seduce And Blackmail Robert Mueller,False,3,802,1543964113
7p9ttr,Four Homeless People Dead In What Girlfriend Refers To As 'Cuddle Weather',False,8,801,1515528474
5vbexp,Man Struggling To Pierce Orange Peel With Fingernail Under Impression He Could Kill If He Had To,False,20,802,1487682968
7g630m,Teacher Frustrated No One In Beginner Yoga Class Can Focus Chakras Into Energy Blast,False,2,795,1511892488
9qy00k,Viewer Prepared To Believe Whatever Documentary Tells Him About Coral Reefs,False,11,794,1540372411
72s0xh,"Being A Senator Means Making Tough Decisions That Aren't Always Popular, Smart, Politically Viable, Or Beneficial To Your Constituents",False,6,801,1506516559
4mv62u,Wealthy Teen Nearly Experiences Consequence,False,22,796,1465245874
a2hvwo,Recruiter Saw Your Background In Computer Science And Thought Maybe You’d Be Interested In Working Part-Time At A Kohl’s In Sioux City,False,7,795,1543788402
7sdo8c,Budweiser Unveils Social Anxiety Bottle With 900% More Label To Pick At,False,5,793,1516705472
9ggbsi,Report: Americans Most Physically Active When Getting Comfy,False,7,786,1537149752
9bv6ns,Relationship Experts Recommend Telling Woman You Would Die For Her At Outset Of First Date,False,15,784,1535733671
88m0vb,Nation Already Sick Of Baseball,False,9,790,1522533489
7xmhiz,"'No Way To Prevent This,' Says Only Nation Where This Regularly Happens",False,151,791,1518652547
7ehxto,Successful U.S. Airstrike Kills 30 Iraqis Who May As Well Have Been Terrorists,False,10,788,1511272120
7wfebj,Mike Pence Condemns Female Senators For Wantonly Sharing Senate Floor With Male Colleagues After Dark,False,13,789,1518200226
970obu,Public Health Win: Coca-Cola Is Releasing A New Line Of Sprite That Turns Blue If Anyone Shits In The Sprite,False,10,778,1534183915
a6zyvg,Congress Cuts Funding For 26-Year-Old Stepson,False,10,776,1545054632
8f5it7,Bill Cosby Feeling Disoriented After Jury Slips Conviction Into His Verdict,False,1,776,1524771716
7us936,Life: Probably Bullshit But Still A Little Scary: Ethan Is Claiming That His Super Soaker Is Filled With Pee,False,7,774,1517587260
9obnft,God Excited About First Trip To Japan,False,22,772,1539601156
9mokrs,Middle-Aged Man In Gym Locker Room Puts Shirt On Before Underwear,False,9,774,1539086940
a6p34w,Matt Damon Loses $500 To Guy Who Promised Professional-Looking Headshots,False,11,769,1544967818
9vtvgc,Report: Average American Spends 25% Of Life Waiting In Line At Cell Phone Store,False,9,766,1541852381
9b2rf4,"Pope Promises More Open, Transparent Molestation In Future",False,12,774,1535490065
a9f97q,Mom’s Christmas Stocking Noticeably Less Full,False,8,763,1545748351
8exwud,Taylor Swift Grateful Kanye West Controversy Taking Heat Off New Swastika Tattoo,False,29,763,1524696929
7l464s,Paul Ryan Slits Auto Mechanic’s Throat To Kick Off GOP Purge Of Working Class,False,15,751,1513801881
97dl2h,Omarosa Searches Through Tapes Of Everyone Else In White House Using N-Word For One Of Trump,False,19,750,1534291629
68u2bc,News: Life After The White House: Obama Just Launched His First Drone Strike As A Civilian,False,22,753,1493741460
8trav1,Roadmap To Peace: Necco Has Set Aside A Roll Of Wafers For Israel And Palestine To Share Only After They Achieve A Two-State Solution,False,18,747,1529939689
8k54zm,This Amazing New Product Called ‘Monocle Glue’ Ensures Your Monocle Won’t Go Flying Off Your Face When Your Daughter Tells You She’s Marrying A Commoner,False,9,745,1526571093
a0j1bw,Man’s Family Rises To Record-High Fourth Priority,False,8,745,1543236380
79qo3s,"‘I’ll Make Those Bastards Pay,’ Teary-Eyed Mueller Whispers Into Locket Containing Photo Of James Comey",False,1,742,1509396958
9itcsk,Heartbreaking: The Thing You Want Is All The Way Over There,False,2,741,1537890973
9ew2hp,Americans Observing 911 By Trying Not To Masturbate,False,13,740,1536658881
9w15k2,Fallen Firefighter Remembered As Idiot Who Sucked At His Job,False,15,736,1541911821
9rjbaw,Florida To Experiment With New 600-Lever Voting Machine,False,9,731,1540547144
9frex0,Apple: New iPhone Good,False,21,727,1536926659
854hq0,Old Man With Foggy Eye Not Even Magical,False,1,732,1521301247
7vgxnx,Probably Bullshit But Still A Little Scary: Ethan Is Claiming That His Super Soaker Is Filled With Pee,False,14,721,1517856522
8wa46q,Concentric Circles Emanating From Glowing Red Dot,False,6,722,1530794377
8p7xvu,Congress Approves $540 Million For Evil,False,18,728,1528351691
82fu58,"Unambitious Loser With Happy, Fulfilling Life Still Lives In Hometown",False,10,720,1520349803
6pwose,Sullen Jeff Sessions Scrolls Through Minority Incarceration Statistics To Cheer Self Up,False,20,727,1501169439
9twbzh,Trump Slams Worldwide Jewish Conspiracy For Not Doing More To Prevent Synagogue Shooting,False,14,725,1541268927
4xqcj4,Michael Phelps Returns To His Tank At Sea World,False,2,724,1471212358
8pbfuh,Fed Up: Steve Harvey Is Leaving ‘Family Feud’ After Yet Another Season Went By Without Somebody Noticing That He Got All Dressed Up,False,16,717,1528386995
4wda7y,New Poll Finds 80% Of Americans Would Just Fucking Destroy A Pan Of Brownies,False,16,713,1470439436
823an0,"News: We Get It, You’re An Ally: Matt Damon Went Totally Overboard At The Oscars When He Ran On Stage Holding Harvey Weinstein’s Severed Penis To Support The #MeToo Movement",False,9,716,1520223255
6p151c,Most College Males Admit To Regularly Getting Stoked,False,10,713,1500814442
7ais26,Kevin Spacey Responds To Assault Allegations By Seeking Treatment For Homosexuality,False,12,714,1509708746
4sml87,Nation Surprised It Took So Long For Primaries To Weed Out Candidate With Genuine Principles,False,6,709,1468407873
a41b9j,The Perils Of Fame: Hundreds Of Screaming Teenage Fangirls Are Currently Chasing The Colgate Toothpaste CEO Through The Streets Of New York City,False,10,708,1544199246
9ar2ox,White House Releases Moving Statement Honoring Woman Who Called Obama An Arab In 2008,False,10,703,1535391769
5ktqq4,I Put On A Fat Suit To Understand What It’s Like To Be Your Mom,False,11,697,1482971719
9azxlx,A Historic Summit: Donald Trump Just Finished A Marathon Day Of Diplomatic Talks With A Man In A Freddy Krueger Costume Who Introduced Himself As The King Of Scotland,False,11,702,1535470533
9rqoqd,CDC Introduces ‘Raw Dog’ The STI Pup To Educate Children About The Dangers Of Unprotected Sex,False,11,696,1540605270
5j9kl1,Electoral College Does What It Was Either Designed To Do Or Explicitly Designed To Prevent,False,10,698,1482187767
8ghrxw,3-Year-Old Pretending Stuffed Animals Having Big Fight About Accidental Pregnancy,False,9,700,1525270988
7py27f,"Trump Insists That Now, More Than Ever, Americans Must Stand Strong In Face Of Empathy",False,6,697,1515777553
6r0a58,Amazon CEO Jeff Bezos: My Advice To Anyone Starting A Business Is To Remember That Someday I Will Crush You,False,5,700,1501630995
84aoou,Entire Life of Universe Flashes Before Stephen Hawking's Eyes,False,5,695,1521001902
7c7zgh,Area Man Afraid Some Woman Might Come Out Of The Woodwork To Hold Him Accountable For Something,False,4,695,1510400786
9uv3n5,Bernie Sanders Fills In For Factory Worker Unable To Take Time Off To Vote,False,17,692,1541557129
883jjj,Police Repeatedly Shoot Tim Cook After Mistaking iPhone For Gun,False,8,693,1522347139
8xqd5z,Beautiful: This Boy Put The Basketball Under His Shirt And Now He Is Pregnant With The Basketball,False,10,691,1531237452
7x21ip,Mitch McConnell Reminds Senators That They'll Have To Make Up Government Shutdown Days At End Of Year,False,3,695,1518454049
53f2zl,"When Will The Idiots On The Other End Of The Political Spectrum Wake Up And Have Every One Of My Life Circumstances, Daily Interactions, And Upbringing?",False,2,686,1474245600
5kg0js,Fucking Weird: This Couple Has 8 Children And They Aren’t Even Religious Or Anything,False,6,682,1482789366
82xbyt,Returning West Virginia Teachers Unceremoniously Toss Hundreds Of Dead Class Pets Into Trash,False,7,686,1520514361
5xvzu1,Middle Eastern Man Not Sure How Many Days’ Worth Of Airport Detention Clothes To Pack,False,4,682,1488835142
7zf3yn,Man Crushed By Lack Of Filth On Q-Tip Pulled From Ear,False,18,683,1519308455
9hga4b,Beautiful Moment: Woman Comes Out To The Pair Of Arms Growing Out Of Her Wall And They Start Applauding,False,8,678,1537457718
8281jb,Disgusted Robert Mueller Eats 2 20-Piece Chicken McNugget Meals In One Sitting In Attempt To Get Into Trump’s Mind,False,11,675,1520274176
7ghj64,News: Is Harvey Weinstein’s Matt Lauer Biopic Starring Louis CK In Trouble?,False,7,670,1511996311
74faj9,New Bill Would Limit Abortion To Cases Where Procedure Necessary To Save Promising Political Career,False,3,673,1507202448
7luy4i,Kids Getting A Little Old To Still Believe In Innate Charitable Goodness Of Humans,False,4,662,1514119064
8k5vnu,Heartbreaking: This Student Using Both Of Her Arms To Shield Her Test Has No Idea She’s One Of The Dumbest Kids In Class,False,3,667,1526576773
5hhk09,"My Doctor Told Me I Should Vaccinate My Children, But Then Someone Much Louder Than My Doctor Told Me I Shouldn’t",False,13,665,1481331936
6zmbks,Video Game Shopkeeper Starting To Get Suspicious After Selling 800 Bombs To Player,False,8,664,1505215368
90gaux,"Real-Life Black Widow? Sure, You Nerds Will Eat That Up. This Captured Russian Spy Is Real-Life Black Widow",False,18,664,1532095834
9xi80u,Man Experiencing First Real Moment Of Peace In Years Resuscitated,False,3,658,1542337380
a30rns,U.S. High School Gets Raw End Of Student Exchange,False,6,656,1543930910
77gkbr,Trump Comforts Grieving War Widow By Assuring Her He Will Never Die,False,20,657,1508439217
6xgqgq,Taylor Swift Unveils Even Darker Persona With New Single ‘Skullfucking Maggot Shit Boyfriend’,False,7,658,1504293031
8fzqgn,Report: Rest Of Pottery Class Knows Each Other From Previous Pottery Class,False,4,649,1525097584
7v6vmu,In The Know: Should The Government Stop Dumping Money Into A Giant Hole?,False,7,652,1517753100
9tered,Local Teen Would Choose Gun With Night Vision Laser Scope If He Joined Army,False,7,648,1541115225
9f0wdf,Bad Game Design: This Incredibly Lifelike Simulation Of New York City Is Ruined By The Unrealistic Presence Of A Spider-Themed Crimefighter,False,10,649,1536696439
7z25nu,Man Who Thought He'd Lost All Hope Loses Last Additional Bit Of Hope He Didn't Even Know He Still Had,False,3,647,1519181588
9lpf0t,Senator Feinstein Wondering If Now A Good Time To Disclose 7 Highly Credible Murder Allegations Against Kavanaugh She Received Weeks Ago,False,11,649,1538767764
9qoqd0,White House Receives Letter Addressed To Gerald Ford Or Current President,False,7,645,1540299639
a8uxq1,God Sick Of New Angel’s Annoying Fucking Voice,False,1,643,1545574416
9yh4sg,Seed Of World War III Planted In Beijing Middle-School Gym Class,False,12,633,1542637064
5q3pw1,You People Made Me Give Up My Peanut Farm Before I Got To Be President,False,21,640,1485357517
5fj452,Half-Dressed Man Frantically Scrambles Out Of Home After Hearing Toyotathon Deals Won't Last Long,False,4,639,1480432193
5xhkky,Heartbroken Russian Ambassador Thought Special Meetings With Jeff Sessions Were Very Memorable,False,3,632,1488643790
82np6h,Military Historians Discover Majority Of Human Warfare Fought By Disguised Women Taking Place Of Ailing Fathers,False,16,627,1520423472
9kh4e1,Bhutanese Man Can’t Believe Pharmacy Already Stocking Stuff For Lhabab Duchen,False,5,628,1538406381
9dw3ht,"‘Rock The Caliphate’ Charity Concert Features U2, Ed Sheeran, Dua Lipa Coming Together To Raise Money For Struggling Islamic State",False,4,625,1536338502
730o2f,"‘Without Them You Could Buy Anything,’ Whispers Amazon Echo As Man Stares Blankly At Family",False,1,623,1506611145
9kksvf,Nation Urged To Be Extra Sensitive To Men Reliving Trauma Of Not Getting Something,False,38,620,1538431088
6g24iz,Trump Asks Entire Senate To Clear Out Of Chamber So He Can Speak To Comey Alone,False,9,619,1496940295
7y6vp3,Flustered Mathematician Unable To Recommend Good Number,False,7,612,1518877338
a15st7,It’s The Sponge. You Love The Sponge.,False,13,614,1543408409
7qc39o,Local Church Full Of Brainwashed Idiots Feeds Town’s Poor Every Week,False,29,610,1515939895
91s6og,Maybe I Can Impress Her With My Holy Grail Quotes,False,21,609,1532528009
9jg4nv,Kavanaugh Claims He Never Committed Sexual Assault As It Will Be Defined After Future Supreme Court Case,False,23,608,1538078134
5w5dzl,Last Male Heir To Bloodline Watches Movie Alone On Laptop,False,5285,608,1488046304
9g9oed,Black Man Given Nation's Worst Job (2008),False,9,601,1537094695
3fsfnm,Obama Turns 50 Despite Republican Opposition,False,5,599,1438719443
8bripe,"My Great-Grandfather Came To This Country With Nothing But $10 In His Pocket, $300,000 In His Bank Account, And A Dream",False,3,598,1523550696
5u0sh5,Tupperware Will Never Truly Recover From Red Curry Leftovers,False,15,599,1487085976
9c6dqg,NASCAR Race Stops To Wait For Family Of Ducks To Pass,False,7,595,1535834489
8cx9ly,"Michael Jordan Attacks Softness, Lack Of Competitiveness In Modern Blackjack Players",False,7,591,1523977940
776bl5,Study Finds Flushing Toilets Wastes Billions Of Gallons Of Piss And Shit Annually,False,1,599,1508331114
54qanl,Poll: 89% Of Debate Viewers Tuning In Solely To See Whether Roof Collapses,False,8,597,1474978941
a2cxn6,Hostage With Family Really Lording It Over Everyone Else,False,1,588,1543754816
787a7h,Bassist Has Little Riff Ready To Go In Case Frontman Goes Around Introducing Everyone,False,1,586,1508760608
8mpjmq,Restoration Of 'Star Spangled Banner' Uncovers Horrifying New Verses,False,22,585,1527508833
5ruxem,"Eric Trump Scolds Father That He Mustn’t Inquire About The Businesses, For He’s Sworn Not To Tell",False,12,583,1486139834
7go4ag,Breitbart Criticized For Publishing Humanizing Profile Of Libtard Beta-Cuck,False,27,575,1512064138
9s3a5d,Crusted Ring Around NyQuil Bottle Top Coming Along Nicely,False,3,576,1540734753
7w3tyw,Child Bankrupts Make-A-Wish Foundation With Wish For Unlimited Wishes,False,2,570,1518084549
5obpvn,Biden Sadly Realizes This Could Be Last Time He Throws Lit Firecracker Into Press Conference,False,14,569,1484583976
7mehs4,Taco Bell Unveils New Taco With Shell Made From Doritos Bags,False,5,567,1514373809
7m7de5,Report: More Americans Forced To Sell Gold Pocket Watch In Order To Afford Set Of Fine Combs For Wife,False,18,570,1514288925
5p5dqv,Departing Obama Tearfully Shoos Away Loyal Drone Following Him Out Of White House,False,4,572,1484934508
88zeha,God Starting To Worry Heaven May Be Haunted,False,6,562,1522676738
7aqfof,Family Without Candy Sits Huddled In Darkened House Like Londoners During The Blitz,False,0,570,1509799612
5wwpyf,"News: A Public Nuisance: Barack Obama Was Kicked Off Of A White House Tour For Shouting, ‘I Already Know That,’ After Everything The Tour Guide Said",False,9,568,1488383531
7hr7o4,Alabama Forced To Release Thousands Of Sex Offenders After Inmates Deny Charges,False,16,558,1512494852
7erd8k,News: No Stone Unturned: Parents Of Missing Children Are Petitioning Shaq To Give His Suit Just One Good Shake In Case Their Missing Children Are Lost In There,False,5,561,1511361543
6ryzzt,Local Dipshit Planning On Fighting Trump Administration Through Art,False,10,551,1502033950
87s4k6,Overworked Nation Wishes It Could Just Unplug From It All Like Puerto Rico,False,7,556,1522245735
78p2h3,News: A New Perspective: Rotten Tomatoes Will Begin Giving Movies A Score Based On The Opinions Of People Who Haven’t Seen The Movie But Generally Have A Good Idea Whether Something Will Be Good,False,8,550,1508951070
71ruad,Blog: Modern Video Games Are Giving Kids Unrealistic Standards For How Many Swords They Can Carry At One Time,False,3,549,1506095233
9iagm5,New Pumpkin Spice Channel To Offer Fall-Themed Hardcore Pornography,False,14,545,1537726092
6sc4ag,School Bully Not So Tough Since Being Molested,False,10,548,1502180160
a1mdsr,Argentina Tightens Security In Anticipation Of Numerous Criminals Arriving For G20,False,4,549,1543531840
9en61y,New Psychedelic Weight Loss Drug Transforms Food Into Monstrous Hallucinations,False,6,548,1536586341
74mxvo,Adult Film Industry Replaces 500 Porn Stars With Hydraulic Robotic Fisting Arm,False,15,542,1507288448
6m5bdu,Female Friends Spend Raucous Night Validating The Living Shit Out Of Each Other,False,7,547,1499570564
6fmow9,News: Just Like Us: This Chimpanzee Shot Himself In The Head After The IRS Uncovered His Tax Fraud Scheme,False,4,543,1496764747
7wda3y,Female Barista Getting A Lot Better At Avoiding Touching Male Patrons’ Hands When They Pay,False,9,545,1518181350
6ftqs3,Report: 87% Of U.S. Women Achieve Orgasm When Fantasizing About Gorton's Fisherman,False,5,542,1496845532
5r8iv8,Trump Supporter Has Few Backup Scapegoats Ready To Go In Case Crackdown On Immigrants Doesn’t Fix Everything,False,9,541,1485873380
a3qyt9,"‘No, Take Jeb Instead,’ Screams George W. Bush While Shoving Brother Into Father’s Grave",False,13,541,1544122514
4nkx90,7-Year-Old Unable To Maintain Single Cohesive Storyline While Playing With Action Figures,False,2,544,1465640998
7jerm6,Baffled DNC Plant Roy Moore Not Sure What Else He Could Have Done To Defame Republican Party,False,8,543,1513119725
9orgl2,Melania’s Heart Sinks After Realizing Husband Uses Pet Name ‘Horseface’ For Every Woman He Fucks,False,8,534,1539721696
8sv2ch,I’m Proud Of President Trump For Replacing The Un-American Practice Of Family Separation With The Profoundly American Practice Of Mass Incarceration (By Mitch McConnell),False,11,535,1529611476
53zj9c,Black Man Blissfully Unaware His Name Going To Be Hashtag By End Of Week,False,33,536,1474558556
