id,title,real,num_comments,score,created_utc
9osqlk,Comcast complains it will make less money under Calif. net neutrality law,True,1254,23476,1539730670
6ar18s,'The Drug Whisperer': Drivers arrested while stone cold sober,True,2614,23425,1494592711
933wvd,Textbook calls cancer a ‘disease of choice’ -- and it’s required reading for UNC students,True,1279,23289,1532956108
5xqiv9,Chicago goes nearly one week without a fatal shooting,True,1206,23214,1488764639
8a0z2b,New Yorkers repeatedly ticketed — even though they don’t have a car,True,1148,23205,1522944380
a0f2xd,Man 'pulled bag of cocaine from penis' after arrest for laughing at cops,True,1039,23063,1543198956
6jlig6,Researchers suggest replacing car honks with duck quacks,True,1022,23036,1498488381
75m9t0,Deputies: Pinellas Park man Googled 'how to rob a bank' then robbed a bank,True,972,23029,1507690530
685mus,"After 5 Days, Man in Gorilla Suit Almost Done Crawling the London Marathon",True,389,23016,1493415599
63eh9h,Wi-Fi sex toy with built-in camera fails penetration test,True,887,23012,1491316650
798xaa,Arizona man selling ranch for $5M due to constant ‘alien attacks’,True,1070,22925,1509176345
82e762,Lego admits it made too many bricks,True,1637,22892,1520333681
6s5ln2,Chinese restaurant offers bra-size discounts,True,1842,22874,1502113505
65rmmd,"Robot being trained to shoot guns is ‘not a terminator’, insists Russian deputy prime minister",True,1192,22835,1492379265
9.76E+073,"London: Firefighter tries rescuing a Macaw parrot stuck in a roof, is asked to 'F*ck off' by the bird",True,311,22783,1534232250
4btpmn,"Microsoft pulls plug after chat robot slings slurs, rips Obama and denies Holocaust",True,1833,22761,1458855672
8x0u5w,"Queen's patronage has single-handedly saved the British hat industry, Philip Treacy says",True,487,22742,1531049227
9dcshz,Rocket City Trash Pandas chosen as new Madison baseball team’s name,True,672,22741,1536193513
7tjf83,Donkey leads escaped herd of goats and sheep through California neighborhood,True,585,22743,1517132875
8ra7k9,Crew called to own station: Response time 'exceptional’,True,435,22670,1529062060
6vu9ee,Report: Some patients treated for putting sunblock in their eyes during eclipse,True,1065,22611,1503612432
6mth1b,NotTheOnion stands for Net Neutrality,True,1062,22585,1499860990
9hhhox,The Teen Who Ashton Kutcher Hit With a Car Is Fine and Says It Turned Out to Be a 'Really Cool Experience',True,684,22575,1537466748
81v58q,"W.Va. lawmakers try to give teachers smaller raise, accidentally pass bill giving them full raise",True,1137,22539,1520132804
8bpzv2,Report of Tiger Running Amok in Manhattan Turns Out to Be Raccoon: NYPD,True,420,22492,1523538418
52gizw,The totally wireless AirPods have their first accessory: a wire,True,1425,22487,1473712532
6sczo6,Italy's Sara Errani suspended for just two months after blaming mum's tortellini for failed drugs test,True,854,22429,1502193423
91x69j,White House on banning CNN reporter from event: 'We support a free press',True,1766,22417,1532562500
5ruhb0,Former Norway PM held at Washington airport over 2014 visit to Iran,True,2213,22388,1486135296
6zf9p0,American Apparel founder Dov Charney: ‘Sleeping with people you work with is unavoidable’,True,2102,22377,1505135239
4xup3o,Dad Accused of Raping Daughter Saved by Mention of 'Fifty Shades of Grey',True,6277,22318,1471281893
9qa3vz,"TPD says man stole car from jail parking lot, moments after being released from same jail",True,1129,22295,1540179906
61fb0n,2 teen girls shot as Birmingham water balloon fight turns into gun fight at Senior Skip Day,True,486,22151,1490445090
78w17i,DOT reminds drivers deer can't read signs,True,885,22124,1509029302
4x82pl,A 2nd Olympic pool has turned green,True,1813,22109,1470923446
7b0y34,"'No Way To Prevent This,’ Says Only Nation Where This Regularly Happens",False,3066,34993,1509921976
7to2ak,Trump Warns Removing Confederate Statues Could Be Slippery Slope To Eliminating Racism Entirely,False,1890,27428,1517182300
7xl7h3,"‘No Way To Prevent This,’ Says Only Nation Where This Regularly Happens",False,1204,21130,1518641440
7jgh6i,Roy Moore Retires From Politics To Spend More Quality Time With Someone's Kid,False,126,18071,1513136185
5pbaag,"Mike Pence Disappointed In The 200,000 Husbands And Fathers Who Permitted Women To Attend March",False,333,16751,1485014898
5se5mg,Mike Pence Disappointed God Has Never Asked Him To Kill One Of Own Children,False,188,15839,1486386847
7t7e6e,Logan Paul: 'I Didn’t Realize People Who Commit Suicide Kill Themselves',False,256,14832,1516998412
7i9in3,RNC: 'We Warned You Gay Marriage Would Be A Slippery Slope Toward Accepting Pedophilia',False,233,13996,1512679980
73sur4,"‘No Way To Prevent This,’ Says Only Nation Where This Regularly Happens",False,1478,12485,1506952033
7lgsq8,Paul Ryan Confident American People Will Warm Up To Tax Plan Once They Realize Life A Cruel And Meaningless Farce,False,383,11447,1513940755
9bkdix,"Heartwarming: When This McDonald’s Employee Had To Walk 20 Miles To Work Because He Couldn’t Afford A Car, The CEO Of McDonald’s Drove Alongside Him To Cheer Him On",False,113,10372,1535641319
7ijh32,Panicked Donald Trump Jr. Tries To Cover Up Contact With WikiLeaks By Deleting Firefox Icon From Desktop,False,151,10144,1512781363
8smqh3,Political Scientists Baffled By Trump’s Ability To End Something He Had No Control Over Just Days Ago,False,341,9091,1529534642
7ui11u,Gay Conversion Therapists Claim Most Patients Fully Straight By The Time They Commit Suicide,False,90,9048,1517483299
9ajm74,"""No way to prevent this"" says only nations where this regualrly happens",False,494,7110,1535322623
8ebmcr,"‘Nothing Is More Attractive Than Confidence,’ Says Woman Who Has Apparently Never Seen Sonic The Hedgehog Cosplay",False,58,7065,1524491712
8keat4,"‘No Way To Prevent This,’ Says Only Nation Where This Regularly Happens",False,412,6320,1526659461
7mzst1,"My Doctor Told Me I Should Vaccinate My Children, But Then Someone Much Louder Than My Doctor Told Me I Shouldn’t",False,86,5158,1514611427
7oaio6,I Won't Have My Daughter Bringing A Black Man Into This House Until I've Tidied Up And Created A Welcoming Environment,False,79,5088,1515149938
9sc79g,"‘No Way To Prevent This,’ Says Only Nation Where This Regularly Happens",False,450,3967,1540812123
9440up,‘The Onion’ Proudly Stands With The Media As The Enemy Of The People,False,89,3299,1533249554
983ymw,‘Paw Patrol’ Writers Defend Episode Where German Shepherd Cop Shoots Unarmed Black Lab 17 Times In Back,False,52,3137,1534525089
98umot,"Liberal Hypocrisy: When Obama Was President Democrats Were Okay With Him Being President, But When Trump Is President Suddenly It’s Wrong To Be President?",False,74,2792,1534779345
6ucokv,Next-Level Gaming: The New ‘Call Of Duty’ Will Penalize Players For Shooting Nazis Who Are Actually Very Fine People,False,35,2766,1503000726
8y0ob1,Hardcore Gamers Only: ‘Overwatch’ Is Increasing Its Difficulty By Adding A Senior-Citizen Character That’s A Financial Drain And Emotional Burden On Their Whole Team,False,34,2740,1531323859
4s6lte,I Was Never Able To Accept My Son’s Autism Until I Monetized It Through Blogging,False,11,2597,1468174256
9b91tu,"When This Boy With A Colostomy Bag Said He Was Sad There Were No Superheroes Like Him, Marvel Told Him It’s Absolutely Crucial For Superheroes To Have A Functioning Anus",False,46,2587,1535547493
7zqqp9,Marco Rubio Still Rock-Hard Days After Being Publicly Humiliated On National Stage,False,39,2436,1519414307
8usaaw,"‘No Way To Prevent This,’ Says Only Nation Where This Regularly Happens",False,142,2384,1530270476
88azeq,"‘I Don’t Fit Into Any Of Corporate America’s Little Boxes,’ Says Single, 18-To-36-Year-Old Hispanic Female With Brand Loyalty To Tom’s, Chobani",False,36,2363,1522422184
7wtr57,Study reveals lobsters feel pain and get off on it like the kinky little perverts they are,False,22,2319,1518366899
9v99e9,'No way to prevent this' says only nation where this regularly happens,False,131,2251,1541677029
7co53a,Fox News Struggling To Attract Younger 60-75 Demographic,False,19,2118,1510589794
7l118p,Man Worried New ‘Jumanji’ Movie Going To Ruin Memory Of Mediocre Afternoon In 1995,False,29,2103,1513772175
94cchx,Christian Pornographer Refuses To Film Sex Tape For Gay Couple,False,37,2091,1533322494
7vzecw,Elon Musk Offering $1.2 Billion In Grants To Any Project That Promises To Make Him Feel Complete,False,24,2059,1518037401
99yjby,Third-Grader Watching Another Year Of Back To School Commercials Suddenly Realizes He’ll Die One Day,False,24,2027,1535125712
7d7wu1,PatriotHole: Liberal Hypocrites: Why Are Dems Criticizing Roy Moore When PEDO PREZ Barack Obama Is Still Married To FORMER TEENAGER Michelle Obama?,False,66,1983,1510785967
935bzb,"Dangerous Teen Trend: It’s Called ‘Worrying That Donald Trump’s Supreme Court Nominee Will Overturn Vital U.S. Civil Rights Decisions,’ And It’s What Millions Of U.S. Adolescents Are OBSESSED With Today",False,60,1979,1532966672
8syrm8,“ We Must Protect The Pure Aryan Bloodline” Says Child After 9 Minutes of Unsupervised Facebook Access.,False,17,1949,1529644433
8bz78k,This Child Would Have Turned 6 Today If His Mother Hadn't Given Birth To Him In October,False,13,1876,1523626563
8lainw,Incredible Realism: The Campaign In The Next ‘Call Of Duty’ Will Begin At Your Avatar’s High School Cafeteria When He’s Being Tricked Into Joining The Military By A Recruiter,False,26,1855,1527000340
7xznk5,"‘Oh God, What Happened Last Night?’ Says Groggy Mike Pence After Waking Up In Same Bed As Wife",False,20,1844,1518796731
97v3ki,Trump Locked Out Of White House After Accidentally Revoking Own Security Clearance,False,29,1782,1534445951
8aaoe3,"Blog: If You’re Not A Police Officer, You Can’t Understand The Pressure You Feel In The Split Second When You Have To Decide Whether Or Not To Shoot An Unarmed Civilian 8 Times",False,26,1765,1523030328
9fj027,Overstepping Her Bounds: J.K. Rowling Has Announced That Daenerys From ‘Game Of Thrones’ Has Crohn’s Disease,False,68,1757,1536852755
a3qyte,Dog Who Successfully Detected Cancer In Owner Put Down For Practicing Medicine Without A License,False,19,1695,1544122515
a4lisj,Stupid 16-Year-Old Completely Wasting Adderall Prescription On Mental Health,False,29,1689,1544367639
9j3xc6,Kavanaugh Sobering Up After 35-Year Bender Shocked To Find Out He’s Supreme Court Nominee,False,51,1671,1537978359
85sz84,"‘No Way To Prevent This,’ Says Only Nation Where This Regularly Happens",False,176,1665,1521554936
9dloeq,‘The Onion’ Has Chosen To Publish An Anonymous Op-Ed From Two Sources Close To Trump Who Think Their Dad Is The Best President Ever,False,21,1605,1536259480
696w4r,Report: Uttering Phrase ‘Easy Does It’ Prevents 78% Of Drywall Damage While Moving Furniture,False,12,1605,1493896764
8d6n6k,"Barbara Bush Passes Away Surrounded By Loved Ones, Jeb",False,25,1600,1524066443
835zb7,Teen who just discovered Led zeppelin starting to piss off friends.,False,57,1601,1520594422
9mf7z6,Voting Machines Elect One Of Their Own As President,False,25,1583,1539008151
9z3tsu,Man At Airport Pissed That Other People Had Same Idea To Go Home For Thanksgiving,False,5,1583,1542811771
86kvii,"U.S. Military Announces Plan To Consolidate All Wars Into Final, Epic Battle",False,26,1576,1521814037
9186sm,Incredible Sacrifice: This Mom Went Without Food For Days At A Time So Her Children Could Have A Smoking-Hot Mom,False,11,1530,1532360971
89q62n,Family Has Way Too Many Daughters For Them Not To Have Been Trying For Son,False,33,1524,1522853770
6vatju,"Trump: ‘We Will Fight In Afghanistan Until Victorious, Or I Change My Mind, Get Distracted, Look Bad, Or Get Bored’",False,15,1514,1503406640
8gzvzw,Amazon Fires Warehouse Worker Who Took Unauthorized Breath,False,9,1508,1525446058
61tz78,GOP Makes Good On 2009 Promise To Block President's Healthcare Bill,False,8,1494,1490639344
a9zflu,Man Who Has Clocked 137 Hours In RPG Can’t Believe He Has To Waste Precious Time Watching Cutscenes,False,35,1466,1545919184
8bhsiw,News: Clearing His Name: Congress Has Exonerated Mark Zuckerberg Of All Wrongdoing After He Revealed That The Winklevoss Twins Were The Ones Who Really Invented Facebook,False,23,1461,1523459408
9v0uh9,More Elderly Americans Keeping Active By Maintaining Control Of Senate,False,17,1450,1541607909
84wy72,"‘I Must Make Sure You Have The Skills To Please My Grandson,’ Says Queen Elizabeth Disrobing Before Meghan Markle",False,23,1450,1521219427
85fzfu,"15,000 Brown People Dead Somewhere",False,11,1430,1521423993
9wdqrm,Generous Military Sends $800 In Disability To Man Who Wakes Up Screaming Every Night,False,38,1423,1542026956
8xdw43,Picky Refugee Just Expects To Be Reunited With Exact Same Family As Before,False,10,1421,1531157128
87bhu5,NRA Says Parkland Students Should Be Grateful For Guns Giving Them Such A Memorable Bonding Experience,False,27,1415,1522089374
8fb22w,Pence Unveils Campaign To Educate Teens About Dangers Of Premarital Eye Contact,False,11,1400,1524830105
8a0hz5,News: Defending The Second Amendment: The NRA Is Attempting To Justify The Sale Of AR-15s By Developing Genetically Modified Super Deer That Can Only Be Hunted With Assault Rifles,False,119,1393,1522941013
9sr1r3,Trump Claims He Can Overrule Constitution With Executive Order Because Of Little-Known ‘No One Will Stop Me’ Loophole,False,35,1389,1540926847
a08445,Woman Who Left Room Crying Earlier Expects To Jump Back Into Party Just Like That,False,12,1393,1543148797
9zepyo,Younger Cousin’s Growth Spurt Throws Off Competitive Balance At Family’s Thanksgiving Touch Football Game,False,6,1370,1542898424
7h3alr,White Guy Held Accountable For Crime,False,27,1363,1512229478
a1sexw,Weird Black Dot Actually Part Of Bowl,False,8,1359,1543584458
8dfeo7,Mom Makes Sure Everyone Has Masturbated Before Long Car Ride,False,30,1363,1524151034
9tl1tr,"Jesus Announces Plans To Return Once The Dow Clears 27,000",False,6,1360,1541172226
a90hyt,I Slapped A Crying Child And Called Him A Nigger And I'm The Bad Guy?,False,27,1353,1545615367
81fjm6,Report: We Don’t Make Any Money If You Don’t Click The Fucking Link,False,23,1353,1520008812
a8c6z7,Hand Of George H.W. Bush Bursts Out Of Ground To Grope One Last Woman,False,30,1345,1545413110
9oxbwy,Police Department Reduces Costs By Using Same Evidence For Every Investigation,False,11,1324,1539771192
99334a,Extremely Polite: This Kid On Vacation With His Friend’s Family Hasn’t Taken A Shit For The Last 6 Days,False,24,1323,1534857748
7z849m,"PatriotHole: Sorry Liberals, But Gun Control Won’t Stop Jackie Chan If He Wants To Take Out 30 People With A Single Mop",False,13,1318,1519240164
85mktq,News: Privacy Win! Facebook Is Adding A ‘Protect My Data’ Button That Does Nothing But Feels Good To Press,False,12,1315,1521490044
93fdid,3 Bible Stories That You Can Bet Would Have Turned Out Very Differently If Jackie Chan Had Been There,False,9,1308,1533050427
9u4q8y,Pope Nervous For Annual Performance Review With God,False,7,1294,1541349412
9sz6l7,Archaeological Dig Uncovers Ancient Race Of Skeleton People,False,17,1296,1540995766
a2p6m6,Modern Science Still Only Able To Predict One Upcoming Tetris Block,False,11,1284,1543847793
9l2iaz,"So Sweet! When This Little Girl Was Scared There Were Monsters Under Her Bed, Her Dad Shined A Flashlight Down There To Show Her It Was Just Some Normal Guys",False,7,1272,1538582693
7mle75,Fearful Americans Stockpiling Facts Before Federal Government Comes To Take Them Away.,False,12,1246,1514449072
8cnxnp,Manager Of Combination Taco Bell/KFC Secretly Considers It Mostly A Taco Bell,False,18,1241,1523889131
a56oc5,Woman Trying To Wean Self Off Coffee By Switching To Long Island Iced Tea,False,4,1243,1544533928
6httmx,WWE Staff Forced To Shoot Aggressive Wrestler After Child Climbs Into Steel Cage,False,14,1240,1497711546
5r3lsb,"Trump Insists That Now, More Than Ever, Americans Must Stand Strong In Face Of Empathy",False,23,1227,1485810862
7xtxlq,Touching: The NRA Is Releasing A Commemorative Line Of AR-15 Rifles To Raise Money For The Victims In Parkland,False,26,1225,1518731937
7quvr0,Trump Vehemently Denies Using Word 'People' To Describe African Immigrants,False,9,1230,1516131461
9uoer3,Poll: 56% Of Voters Say Country Better Off Than It Was 4 Eons Ago,False,11,1228,1541511898
9zyf2d,Entire Shopping Mall Quietly Dreading Whatever Empty Stage Set Up For,False,14,1216,1543065813
8n3i9c,ABC Criticized For Unrealistic Portrayal Of Racists Actually Facing Consequences,False,13,1214,1527634232
9d73vg,PR Disaster: Nike Is Under Fire After It Released An Ad Featuring A Photo Of Colin Kaepernick That Was Way Too Close Up,False,36,1209,1536158014
7jr3yu,'Repealing Net Neutrality Will Help Spur Innovation' Announces Face Of Ajit Pai Blaring From Every Computer Screen In Nation,False,4,1214,1513252422
7ymr57,Man Still Trying To Find Right Work-Anxiety–Life-Anxiety Balance,False,8,1204,1519048205
89eeu7,"'Carpe Diem,' Says Man Who Spent Previous Day Masturbating In Darkened Room",False,16,1197,1522766228
9ylkd9,Jim Acosta Immediately Decks White House Intern After Being Let Back Into Press Pool,False,18,1200,1542665347
80lufv,Barbaric Fifth Grader Gouges Paper Onto Binder Ring Without So Much As Hole Punch,False,10,1196,1519732235
9r2707,Chuck Schumer Relieved He’s Never Taken Stance Meaningful Enough To Have Someone Mail Him Explosive,False,13,1175,1540404965
a8lrna,Woman Who Changed Self To Please Boyfriend Enjoying Happy Long-Term Relationship,False,9,1178,1545493544
7uyi1c,"Researchers Find Decline In Facebook Use Could Be Directly Linked To Desire To Be Happy, Fully Functioning Person",False,29,1158,1517651624
80a195,Supreme Court Rules Death Penalty Is ‘Totally Badass’,False,18,1157,1519616623
a26aog,4 Ancient Civilizations That Independently Developed Rudimentary Versions Of ‘Seinfeld’,False,7,1142,1543694776
9x0mlw,Paleontologists Determine Dinosaurs Were Killed By Someone They Trusted,False,7,1140,1542206248
8qjt7d,Master Dealmaker: Donald Trump Negotiated With Kim Jong-Un To End The U.S.’s Nuclear Weapons Program In Exchange For Reduced Sanctions On North Korea,False,37,1139,1528817168
8cg2eo,Parents Gently Explain To Son Why Family Dog Had To Be Blown Up With Dynamite,False,15,1138,1523808191
9jo5z8,Study Finds Humans Evolved Fingers To Stop Dropping Stuff,False,26,1132,1538150116
9q2ubj,Video Game Henchmen Plan Meetup Around Explosive Barrels,False,6,1128,1540121483
a3ddu2,Life-Saving Drug More Accessible To Lab Rat Than Majority Of Americans,False,23,1130,1544024391
9pp6e6,"‘You Are All Inside Amazon’s Second Headquarters,’ Jeff Bezos Announces To Horrified Americans As Massive Dome Envelops Nation",False,10,1125,1539992026
9gm1v1,Kavanaugh On Sexual Assault Allegations: ‘I Miss High School’,False,21,1126,1537203196
8ykout,Half Of Morning Run Spent Trying To Change Song On Phone,False,14,1128,1531494130
9tsjmv,Wealthy Americans Assure Populace That Heavily Armed Floating City Being Built Above Nation Has Nothing To Do With Anything,False,21,1122,1541233978
99e8k0,The Duality Of Man: This Little Boy’s Screams Are Similar To Those Of A Little Bitch,False,6,1120,1534951330
9m7ts3,Man At Park Who Set Up Table Full Of Water Cups Has No Idea How Passing Marathon Runners Got Impression They Can Take Them,False,9,1112,1538939642
9wocf9,Roommates Assured Girlfriend Only Staying Over For Entire Duration Of Relationship,False,14,1103,1542109239
9w60so,"Heartwarming: When This Kid Was Eating Lunch Alone, His Classmates Summoned The Devil To Sit With Him",False,10,1101,1541960115
83ush1,Classic: Why Do All These Homosexuals Keep Sucking My Cock?,False,22,1105,1520859812
9gw22h,Jumping The Gun: This Kid On A Road Trip Just Started Pissing Into A Bottle Without Even Asking His Parents To Find Him A Bathroom Or Anything,False,15,1096,1537286168
97iyn6,Absolutely Amazing: Biblical Scholars Have Discovered That Christ’s Eyes Were Much Lower Down On His Face Than Previously Believed,False,17,1087,1534345353
9pisqp,Lottery Ticket Holder Has Already Spent $900 Million In Anticipation Of Winning Big Prize,False,9,1085,1539947242
7fmur6,"Papa John’s Comes Under Fire For Cruel Treatment Of The Bulbous, Deformed Creatures That Lactate Pizza Sauce",False,12,1079,1511702472
a7po9n,Man Spends Long Day At Work Waiting To Go Home And Be Lonely,False,32,1077,1545247882
9njg3l,Couple’s Fucked-Up Presex Ritual Involves Tucking Both Kids Into Bed,False,8,1071,1539343623
9f8m59,Look Who Came Crawling Back: The Filthy Public Toilet Stall You Thought You Were Too Good For Turned Out To Be Your Best Option,False,7,1070,1536765159
8uagaz,Another Failure: Facebook Is Scrambling To Beef Up Security After Discovering Millions Of Users Who Falsely Listed Their Education As ‘School Of Hard Knocks’,False,12,1076,1530112755
9h5tsv,Local Man Unsure If Woman Type Of Lesbian Who Only Dates Women,False,16,1071,1537368787
9zommw,Thanksgiving Affords Nation Rare Opportunity To Eat Large Amounts Of Food While Watching Football,False,5,1071,1542982749
9rvdrs,Plan To Be More Positive Off To Shitty Fucking Start,False,9,1055,1540656350
8hnyjo,Flying Safety FTW! American Airlines Will Be Placing A Weapon Under The Seat Of Each Passenger To Be Used In The Event Of An All-Out Battle Royale,False,17,1061,1525703796
7x8r81,Olympic Drug Testing Official Left Horribly Disfigured After Coming Into Contact With Russian Urine,False,13,1057,1518521096
95z7wn,A Major Advantage: Microsoft Has Released A New Xbox Controller With Pre-Mushed-In Buttons That You Can Make Your Friend Use Since It’s Your House,False,8,1055,1533840491
9wsi6r,Hillary Launches Campaign To Raise $100 Million Or Else She’ll Run For President,False,151,1053,1542139169
7nwrpc,"Devastating: This Guy Knows Exactly How Black People Should Act Around Police Officers, But He Has No Black Friends To Tell About It",False,7,1053,1515005814
a0uuex,Man Pretty Sure He Could Run This Company Into Ground Way Better Than Boss,False,2,1027,1543325344
8eu4ui,Warden Figures Week In Solitary Ought To Teach Inmate Not To Be Schizophrenic,False,10,1029,1524667816
92dckp,"Privacy Violation: If You’ve Started Noticing Bananas That Look Like You, You’re Not The Only Facebook User Whose Data Has Been Sold To Chiquita",False,8,1019,1532704351
8gqzbs,"When This High Schooler Asked Emma Stone To Be His Date To Prom, She Said Yes But Then Got So Trashed In The Limo On The Way There That She Didn’t Even Make It Into The Dance",False,19,1016,1525359440
9cljm9,Alabama Begins Offering Tax Credit To Attract More YouTube Fail Compilations To Be Filmed In State,False,4,1016,1535981976
9locpa,Trump Wakes Up Covered In Dozens Of Small Cuts After Being Chased Through Dreams By Razor-Blade-Fingered Robert Mueller,False,21,1010,1538760548
9i3exp,Police Say School Shooter Had History Of School Shootings,False,15,1008,1537653170
9edtyy,Fan Going To See How First Few Games Go Before Declaring Moral Objection To Watching NFL,False,3,1004,1536507367
8440kj,FDA Cancels Bacon Recall After Finding U.S. Population Already Ate It All,False,7,999,1520946609
7vbbdd,Controversial Puppy Bowl Star Shits During National Anthem,False,11,1003,1517794784
7u6gt3,Trump: 'It's My Honor To Deliver The First-Ever State Of The Union',False,17,1002,1517365191
8yavr9,Daring To Dream: Jeff Bezos Is Standing Outside A Guitar Center Gazing Longingly At A $200 Billion Guitar,False,17,1002,1531410272
9cwoql,No Big News For Bagels: The Bagel Industry Just Issued Its Daily 600-Page Report On The State Of The Bagel Industry And Nothing Major Has Changed Since Yesterday,False,14,995,1536075147
5bziyy,Nation Elects First Black-Hearted President,False,20,998,1478677149
a6c0rs,Study Finds Exposure To Violent Children Causes Increased Aggression In Video Game Characters,False,4,990,1544845787
9t8lzh,Toddler Shits Her Way Through 3rd Halloween Costume Of Night,False,9,990,1541072057
9p9n9c,Impressive New Hire Figures Out Bare Minimum Of Work Job Requires On First Day,False,19,983,1539872044
5vjman,"Life: Heartwarming: When Steven Tyler Found Out There Was An Aerosmith Fan With Only 2 Weeks To Live, He Suggested A Bunch Of Better Bands She Should Check Out",False,6,992,1487780723
9xo00e,Khashoggi Assassin Hopes Bonus Check From Saudi Crown Prince Clears Before Execution,False,11,990,1542387877
8f308e,Experts Warn Beef Could Act As Gateway Meat To Human Flesh,False,12,988,1524752425
84e4w8,New Workplace Diversity Initiative Kills One White Employee Every Hour On The Hour Until More Minority Candidates Hired,False,34,985,1521040485
9mt77c,Banksy Hospitalized With Third Degree Burns After Attempting To Cash Self-Destructing Check,False,25,984,1539120095
a97702,"""Transgendered"" sea anemone denounced as abomination by Clergy.",False,9,968,1545674704
9yt1i9,Report: More Colleges Offering Dick-Around Abroad Programs,False,12,971,1542727056
606wka,"Everyone In Middle East Given Own Country In 317,000,000-State Solution",False,7,970,1489877066
85u740,"‘My God, I’ve Discovered The Missing Link In The Russia Investigation,’ Think 379,000 Reddit Users Simultaneously",False,19,966,1521564247
a5i0zk,Scientists Make Discovery About World’s Silt Deposits But Understand If You Aren’t Interested In That,False,12,953,1544620453
a1gqjh,Man Puts Glass Of Water On Bedside Table In Case He Needs To Make Huge Mess In Middle Of Night,False,7,946,1543492870
81pyoc,Pope Francis Finds Self In Hell After Taking Wrong Turn In Vatican Catacombs,False,6,952,1520081662
a6hsy0,Soldier Back Home From Serving At Mexico Border Still Having Nightmares About Being Used As Political Prop,False,5,949,1544900584
9xx538,Biologist Completes 5-Minute Study Of Pathetic Organism In Mirror,False,9,944,1542468151
